886914717326770176,2017-07-17 11:45:21,shanaticniko,"everyone should checkout this artistic ambience #TheBandraProject for having some good time n to check
all the yummy food @theprojectin"
886899610848870404,2017-07-17 10:45:19,pauldnewint,Everyone should read this:https://t.co/hvdL1veuq6
886884511606112256,2017-07-17 09:45:19,aronachs,"Everyone should read this, all the best bro 💪🏻 https://t.co/QVHtyOzayT"
886869419602739200,2017-07-17 08:45:21,kp_85,Everyone should watch the #JaggaJasoos movie for sure.
886839216134434818,2017-07-17 06:45:20,PO_Tomato,everyone should go to bed it's past your bedtimes
886824116392570880,2017-07-17 05:45:20,FollowMyHandle,Everyone should check out the link that kills all torrents - https://t.co/V5BmQ8eTZY #TorrentsMorghulis watch season7 of GameOfThrones
886809023881687041,2017-07-17 04:45:22,denises4884,Everyone should go check him out 👌🏻 https://t.co/mCycf3RiTA
886793913444347904,2017-07-17 03:45:19,emgrace98,everyone should watch this https://t.co/HUosFzxa5C
886778816852410368,2017-07-17 02:45:20,Fed_up_Jane,Everyone should be accountable under the law whether president or not. Looking guilty is not the same as being guilty. https://t.co/M6KpkduSzZ
886748616475398144,2017-07-17 00:45:19,eimaj1106,Everyone should go follow my bestfriend @mjham23 ❤️❤️❤️🍫 https://t.co/facQTHsSt7
886718416412790784,2017-07-16 22:45:19,alyssssaann,Everyone should watch chasing coral on Netflix.
886703328830251008,2017-07-16 21:45:22,ConciAlthouse,Everyone should experience the exceptional combo of filling out divorce paperwork while watching The Handmaid's Tale.
886688214878011392,2017-07-16 20:45:18,Jaylunatics,"Everyone should av their own Jesus Christ,not just dis dude all the time. Lets av some Asian,black,Dominican,Pakistan Jesus Christ plz.. https://t.co/0TfsJ35PgB"
886673117707255808,2017-07-16 19:45:19,Thejoeguti,"Everyone should love themselves, but there's a limit. No one should be comfortable living like this, it's unhealthy... end of story! https://t.co/k9vj4INcXY"
886658030703525888,2017-07-16 18:45:22,DJHIGHTZZ,Everyone should be off Sunday's .... #FACTZ
886642918173233152,2017-07-16 17:45:19,Love_ON_Lex,Everyone should be free to be themselves but instead majority of ppl choose to be the exact opposite
886627821111590912,2017-07-16 16:45:19,Donnydinker,"EVERYONE should be the kind of model citizen like J.R. is!!  Cleans up after lazy, no good scum that litter our America!! https://t.co/ynQKlHhrn6"
886612727224979456,2017-07-16 15:45:21,michllons,"everyone should watch this, including @lorde https://t.co/rEwwkX4cwp"
886597614036074497,2017-07-16 14:45:18,17thdegree,Everyone should pay respect to this art https://t.co/PxVMVlFlNn
886585034475425792,2017-07-16 13:55:18,joolzsz,everyone should watch natsume yuujinchou if u like to cry every 20 mins
886567434278256644,2017-07-16 12:45:22,Longshore_Law,Everyone should read this thread. #SaveTheACA https://t.co/0GA9hAGWUq
886552336088285184,2017-07-16 11:45:22,annakozuki_en,"Everyone should really just be bowing down to my ultimate boobs because… sighs, well just look at them.
…perfection."
886522132443693057,2017-07-16 09:45:21,DanBavuso,Everyone should listen to @billburr give advice
886507023344349184,2017-07-16 08:45:19,Rosemarie_Moina,everyone should meet my main squad 💝 @justPaulBruno @keyy_si @Joshmaravillaa https://t.co/JdDWBhlVoL
886491938781749248,2017-07-16 07:45:23,anirudh1010,Everyone should check this initiative by Tehseen Poonawalla opposing the most barbaric practice of lynching https://t.co/seMXWmMUMR
886476835214589952,2017-07-16 06:45:22,Isatyajitghosh,Everyone should support this initiative on MASUKA by Tehseen
886461724626362368,2017-07-16 05:45:19,pizz4_steve,everyone should just draw self insert art all the time is my oppinion
886446637542809602,2017-07-16 04:45:22,Puspalata25,Everyone should avoid  #JaggaJasoos
886431527218757632,2017-07-16 03:45:19,m_kongphat,Everyone should visit a nude beach once in their life #spectacular
886416436859510784,2017-07-16 02:45:22,I3ryce,Everyone should go follow my dude @hanukkahjambore
886401325784748033,2017-07-16 01:45:19,mark3ting0nline,Everyone should read this post from Katrina White. Believe in yourself and good things will happen for you. https://t.co/di3i0cBPra
886386227422699521,2017-07-16 00:45:19,twicedtea,EVERYONE SHOULD STAN THEM https://t.co/pwcmjoebjZ
886356027859320833,2017-07-15 22:45:19,shaolinswings,everyone should download ecosia
886340938343227392,2017-07-15 21:45:21,pjmoles,everyone should watch homecoming
886325828899831808,2017-07-15 20:45:19,Aaron_Catano,"Everyone should be a damn cleric tbh. ""I cut my finger while ya know, building my fucking house. Ha ha jk im healed bc magic. Ima god"""
886310741950685184,2017-07-15 19:45:22,criesmyg,"Everyone should stan Monsta X, y'all stepping on talent and visuals. 🤧😤😤😤"
886280537035362304,2017-07-15 17:45:20,JaidanStockill,everyone should be going to see @pineband today at bluesfest!!!!
886265431295643649,2017-07-15 16:45:19,NOVEMBER1_8,Everyone should watch friends from college on Netflix. It's pretty good
886250332279275521,2017-07-15 15:45:19,bryceminnie_,Everyone should listen to this because it's so good and it's my boy Jimin singing so it's BEAUTIFUL! https://t.co/Wtx0oIUdKd
886235242779955200,2017-07-15 14:45:21,GigiKaren53,Everyone should watch this! Short but good. https://t.co/ZhvZFPXu96
886205045666009088,2017-07-15 12:45:22,k_dval_x,Everyone should just settle down and let Primark humble their pride.
886189934268121089,2017-07-15 11:45:19,noori_tweets,Everyone should join this HT and support this noble cause #HelpMahzaibGetToIndia https://t.co/Y9fnjwQSTv
886174833423155200,2017-07-15 10:45:19,Bint_bin1,Everyone should serve #Islam according to his/her abilities
886159733773656065,2017-07-15 09:45:19,lavenderhotels,Everyone should squat more! https://t.co/wOBfm8EjxN
886129537729257472,2017-07-15 07:45:19,AlexisLynnEllis,Everyone should adopt a platypus from time to time
886114436557062144,2017-07-15 06:45:19,NvargasXo,Everyone should have  a few doses of truth serum that they have to choose wisely when to use
886099346126536704,2017-07-15 05:45:21,mwanteddj,Everyone should dance as if no one is watching and sing as if no one is listening! https://t.co/PvF4Ezz1c4
886069160123420672,2017-07-15 03:45:24,christian____15,Everyone should go by the 3 year move : cannot go out with Someone that’s more then 3 years younger/older than you FACTS
886054037820325890,2017-07-15 02:45:19,MitchTrips_,Everyone should watch this documentary called Blackfish super sad
886023838034567168,2017-07-15 00:45:19,TheLifeOfJas__,Everyone should start watching Snowfall
886008742583484416,2017-07-14 23:45:20,Queen_Meghna,"Everyone should fall in love
But when it's not there
Anymore
Don't tolerate or carry the corpse
Fall out of love
Immediately"
885993652681453568,2017-07-14 22:45:22,Nethandor,Everyone should experience a Suite concert once @TheVeganVixen @SkylaFay_StL @MelissaSweet1_ @Brianb332 @TheBigDave46 @robert_f182 https://t.co/G04uPtVssE
885963452665221121,2017-07-14 20:45:22,senyoritaita32,Everyone should have headsets so they can enjoy @PRNlive broadcast banter. It warms my ❤️. #NASCAR
885948342382895108,2017-07-14 19:45:19,LILbooKlovers,Everyone should go read Jaded by @kmrobinsonbooks! I just finished it today and it blew me away!!!! Go check it out!!
885918164302741505,2017-07-14 17:45:24,nick_solander,Everyone should check out @JefferyAustin #StayTheNight. The song is absolutely incredible.
885903054821703680,2017-07-14 16:45:22,peter236uk,"Everyone should have a Chabal Bear LOL
https://t.co/oJv18DNnh6 https://t.co/OVfJGW210a"
885887942417276929,2017-07-14 15:45:19,alexisorsumn,"everyone should do this, keeping wages secret is how they exploit yooouuuu https://t.co/39kZPRCqF1"
885872856621490176,2017-07-14 14:45:22,_nighthawk69_,Everyone should take a body language class or watch some videos. It's interesting stuff and I have been using it to my advantage
885857754920779776,2017-07-14 13:45:21,XO_Madiiii,Everyone should have a best friend like @kaitlynpaige_96 💋💋💋 #myperson ❤️
885842647151132672,2017-07-14 12:45:19,morgan_244,everyone should be a supporter of sunglasses as an accessory even when it's not sunny they're cute and they hide your greasy hair https://t.co/kkHYUEW5Uy
885827549074345985,2017-07-14 11:45:20,potaohead,Everyone should have to work in retail at one point in their life.
885812457544888320,2017-07-14 10:45:22,tinytoadgirl,Everyone should try drawing an egg! It's so easy it's basically just a circle but longer. Not a bad art project https://t.co/S76fynIK5M
885797349414522880,2017-07-14 09:45:20,nessaandradex,Everyone should be this excited for drinks and kissys with me right? Yay! HA https://t.co/cAVX0aE877
885767146273357824,2017-07-14 07:45:19,MultiLerman,Everyone should be like this but sadly not many ppl is like this https://t.co/dwDuwwUG5h
885752061211549696,2017-07-14 06:45:22,BoscoUnchained,"Everyone should post a pic of @narendramodi with a dog filter on all social media platforms.
There are jobless folks who file such FIRs. https://t.co/70rcaJEVoY"
885736948437884928,2017-07-14 05:45:19,Fnz162,Everyone should know vixx 😌 https://t.co/XIUc2AOkK5
885721847865548803,2017-07-14 04:45:19,MongeonRon,Everyone should see the movie 13 Hours!Tells truth of what went down in Benghazi and how 6 REAL heroes who didn't obey orders to STAND DOWN!
885706776066244608,2017-07-14 03:45:25,_madison_A,"Everyone should have a bestfriend like Pat, but not Pat, because he's my bestfriend 😛❤ https://t.co/xdIrh2CMl0"
885691652047646720,2017-07-14 02:45:19,jffcrmr,"Everyone should take on net neutrality.

The Yelling Man Takes On Net Neutrality https://t.co/d43dNVZQu1 #Funny"
885676550389022720,2017-07-14 01:45:19,AshleighPat,Everyone should be watching The Defiant Ones on @HBO this weekend. ❤️🔥❤️🔥❤️🔥
885646362628341760,2017-07-13 23:45:22,Onyema_Grace,Everyone should watch WestWorld...
885631254971928578,2017-07-13 22:45:20,melissaseaa,Everyone should go watch @OKJAnetflix ITS SO GOOD I CRIED LIKE TWENTY TIMES
885616154105991168,2017-07-13 21:45:19,inmatemd,EVERYONE should watch this video. This is what happens when Islam takes over an area. Muslims breed like rats and children get more radical https://t.co/3Az5ftanYe
885601070600208384,2017-07-13 20:45:23,halbpro,"Everyone should go see @TapeFaceBoy, exceptionally good!"
885585956740280321,2017-07-13 19:45:20,SourfacedSonia,"Everyone should follow Sean, cause he is funny and you can tell him how shit #EastEnders is at the mo!!! #ShitEnders https://t.co/ODhiAX72gm"
885570854943285248,2017-07-13 18:45:19,allworknosleep,"Everyone should go check out @clarkorr's store and pick something up! I just got a few things myself. Use the code ""25off"" at checkout!"
885555764877680640,2017-07-13 17:45:21,MortySC137,Everyone should download this game and fight me #PocketMortys https://t.co/VhAjHBloNA
885540656222920704,2017-07-13 16:45:19,yesgrli,everyone should go watch @beamiller 's new mv :) https://t.co/JTQVeTd2Rt
885525557747654657,2017-07-13 15:45:19,Pink_0204s,Everyone should feel special on their birthday ... THAT IS YOUR BIRTHDAY. The day you came to dis world
885510457179623424,2017-07-13 14:45:19,legendofchelda,Everyone should click this and read it right now bc it is maybe the most important thing in the world imo https://t.co/uim6fjX4KE
885495356523401216,2017-07-13 13:45:19,mesmerizedgf,Everyone should go give her a follow! 😊 https://t.co/5UL7SfYbo4
885480282106634240,2017-07-13 12:45:25,pablo26p,"Everyone should see @ODakotaFanning  short film ""Zygote"" directed by Neill Blomkamp. Free to watch on Steam. Reminiscent of ""The Thing"""
885465167147945985,2017-07-13 11:45:21,emmanuellagrce,everyone should be respected
885450057851355136,2017-07-13 10:45:19,jiminhiqh,Everyone should notice wooji's visuallllllllll!!!!!😍😍😍 https://t.co/x5oLlMBPm5
885434963079741440,2017-07-13 09:45:20,helen_shabani,Everyone should love their children the way DJ Khaled loves Asahd
885404771649077248,2017-07-13 07:45:22,wrongcar,Everyone should have a northern soul day once in a while. Today is one of those days...https://t.co/qBGYCFN9nS
885389671894704129,2017-07-13 06:45:22,kaetlyn_medina,everyone should read more into astrology
885344362015608833,2017-07-13 03:45:19,nicoleeel,everyone should read this. https://t.co/33jCZcoN1V
885329271056506880,2017-07-13 02:45:21,arihalbkram,Everyone should read this thread. It's charming and funny and a little bit very important reading. https://t.co/RidUKs5uHI
885314162510880768,2017-07-13 01:45:19,SantaCruzPL,Everyone should follow her lead! https://t.co/AzfwH6wAfL
885283967359795201,2017-07-12 23:45:20,_kari18,Everyone should read this thread!!! https://t.co/uRpgjQEX9U
885268878036615173,2017-07-12 22:45:22,holIowmoon,Everyone should definitely #BuySorryNotSorryOniTunes 💗 love you @ddlovato #SorryNotSorry https://t.co/vRC4XqV9hi
885238666313965568,2017-07-12 20:45:19,xSpYIDeRx,Everyone should definitely go and sign. It's super important. #netneutrality https://t.co/MmzOXtpzYk via @demandprogress
885223566047797248,2017-07-12 19:45:19,kellanyharris,Everyone should read this!! https://t.co/290nZvDq48
885208467044155393,2017-07-12 18:45:19,Matej_Vidic,"Everyone should listen to this. If done properly, #Olympics can change the city and country. If not, we have problems, like everywhere else https://t.co/GYBsvYnDoJ"
885180780858572800,2017-07-12 16:55:18,mailandmusic89,Everyone should hear and believe this! If you dont change your mind about yourself because you are! https://t.co/fd0x8KTSkC
885178270232174592,2017-07-12 16:45:20,tceplus3,"Everyone should remember it's only okay to demonize conservative news outlets. Attacking liberal MSM is scarrryyyy.👻 🙄
#WednesdayWisdom https://t.co/ivnfeAJmhm"
885148069968265216,2017-07-12 14:45:19,zatoichibro,"Everyone should say mean things in twitter, once in a while else you will be reported on."
885117868282478592,2017-07-12 12:45:19,Hatzola,Everyone should know how to perform CPR. One day it may save someone's life. https://t.co/lCcQNDiHtr
885102772001132544,2017-07-12 11:45:19,LPeconi,Everyone should go follow @Hi_No_Akuma cuz yeeeeeee friendship *hug*
885087672141840384,2017-07-12 10:45:19,TheShreeTweets,Everyone should buy this #PaytmMallExclusive  @Livpure #ThisMonsoonLivpure  https://t.co/sWf4dN2cQ9
885072578540392448,2017-07-12 09:45:21,danielhall,Everyone should use digital publishing in their business... here's how to do it https://t.co/LEKIFmAvme #podcast #digitalpublishing https://t.co/Sf7swxPBkl
885057473375346689,2017-07-12 08:45:19,SheriLK62,"Everyone should watch Zembla (2 pts) documentary on youtube! Names &amp; faces for alk these Ruski connections, esp Sater. https://t.co/SQt43Rar9R"
885042374329630720,2017-07-12 07:45:19,Gowthaman_csk,Everyone should take the MASUKA Pledge against Mob Lynching! https://t.co/zJ2v4Ciqc6
885027286872977409,2017-07-12 06:45:22,Housesitting,Everyone should try an age-gap friendship. Great friendships happening the @housesitting office also.  https://t.co/GUVpfALQk5 via @MetroUK
885012175458357248,2017-07-12 05:45:20,livengoodlady,"Everyone should read this, @GothamGirlBlue is right. https://t.co/pR2FkDTDTg"
884981974309380096,2017-07-12 03:45:19,saleahlackey,"Everyone should know by now not to lie to me. Those close to me especially. I know everything &amp; if I don't know now, I'll find out later."
884966877880909824,2017-07-12 02:45:20,eatwithjoe,"Everyone should try this!

Text 572-51 with the words “send me” followed by a keyword, a color,… https://t.co/eLAhZ3fqJX"
884951778843688961,2017-07-12 01:45:20,jjwriteswords,Everyone should love and appreciate @w0w_linds3y because she's an amazing friend even when I suck. Protect her from this 🌎
884936676161630208,2017-07-12 00:45:19,azhlyzazhyl,everyone should take this into consideration &amp; I mean EVERYONE !! https://t.co/kT2hYzKDQJ
884921578978287616,2017-07-11 23:45:20,CamehZoR,Everyone should ask themselves when was the last time you were truly happy
884906475520315393,2017-07-11 22:45:19,sarahcarbonara_,everyone should be able to do whatever they want without being judged for it!!!
884891378458558464,2017-07-11 21:45:19,UlySays,Everyone should boycott MayweatherMcGregor! It would be hilarious.
884876280499363840,2017-07-11 20:45:20,chanelrefa,Everyone should want this not just these two. @FreedomEdProj #prison #fepps https://t.co/evMQXrvMXg
884861181080383488,2017-07-11 19:45:20,CPWorld90,Everyone should learn this tbh https://t.co/RPScn2970g
884846080579391489,2017-07-11 18:45:19,LungIllinois,Everyone should have a yearly check-up including kids with asthma. Check in with your doctor before school starts! https://t.co/71LYro3n1c https://t.co/8tgsSuo5hw
884830992225116160,2017-07-11 17:45:22,VarikLoran,Everyone should stand up for an open and free internet tomorrow.  #NetNeutrality https://t.co/LW0Ht0f3Su
884815881515147264,2017-07-11 16:45:19,urwaifu,Everyone should experience a microderm at least once https://t.co/NEZl7qL3TE
884800784696713216,2017-07-11 15:45:20,colete,"Everyone should read this. Not only baffling, but frightening. https://t.co/yFrMhaHcKw"
884785684094959616,2017-07-11 14:45:20,tyday0,Everyone should watch footnotes of 4:44
884770582478241792,2017-07-11 13:45:19,AutumHellerud,Everyone should have @PainZane for relationship advice 😂😂
884755493515780098,2017-07-11 12:45:22,hellrippermetal,Everyone should check out Blackevil https://t.co/5I0Gr8ZGbx #metal #thrash #rock evil
884740385074929664,2017-07-11 11:45:20,nickoehne,Everyone should own a boat at some point in their life
884725284452179968,2017-07-11 10:45:19,intertwinedsoph,everyone should stan @bridgitmendler and stop acting like she disappeared after lemonade mouth
884710185733726208,2017-07-11 09:45:20,TheSullis,Everyone should use their arms more than normal today !!
884695087552151552,2017-07-11 08:45:20,gapyear,Everyone should feel like this ✈️🌎 https://t.co/77bSbgZv9g
884679995976671232,2017-07-11 07:45:22,TheDailySamK,Everyone should play @hentaiphd's new (free!) game Lost Memories .net. Really brought me back in time and hit really close to home for me!
884664884717158400,2017-07-11 06:45:19,ItsJonners,Everyone should play this over and over!! I love it! ♥️♥️♥️♥️ https://t.co/qplYY4Amrb
884649786426531840,2017-07-11 05:45:19,wadelinend,Everyone should read this article 👇🏼 https://t.co/PxA3QWxpjf
884634697644490752,2017-07-11 04:45:22,blackwomencare,Everyone should respect law enforcement and authority.  We all should be able to call and depend on law enforcement.
884619587416977408,2017-07-11 03:45:19,CINEFlLM,everyone should go follow @deservestomeet_ and request celebs + quote their tweets👏🏻
884604487414857728,2017-07-11 02:45:19,nevermellow,"Everyone should read this GOLD. Everyone.
 https://t.co/zMxOfNZkJe"
884589410091548674,2017-07-11 01:45:24,BritBrat_12,"Everyone should check out @IconicControl they have some amazing controllers for a cheap price and use could've ""britbrat"" !!!"
884559202152136704,2017-07-10 23:45:22,CatcherSass,Everyone should watch this.  https://t.co/GgMvTKQ8vu
884544098811523073,2017-07-10 22:45:21,karmasguru,everyone should go ahead and make their way out the closet too
884513892327505922,2017-07-10 20:45:20,sassyassdolans,"EVERYONE SHOULD CHECK OUT #MatthewsNewVid 💥😱

VINNY HITS LA?!?!
👉🏻 https://t.co/rg79xJMLRX 👈🏻

like &amp; subs 🤙🏻
@TheMattEspinosa x3"
884468594750312448,2017-07-10 17:45:20,greensun54,Everyone Should Sell Their Fossil Fuel Stocks https://t.co/wuOYbkG0NU
884453501169946625,2017-07-10 16:45:21,Jay4lores,Everyone should take time out of their day and do this lol https://t.co/jLsZHqAXLS
884438395270815746,2017-07-10 15:45:20,fronssss,Everyone should read the new @ScottMcClanahan book https://t.co/sleQO5tQUr
884423304655773696,2017-07-10 14:45:22,bailey_melvin,Everyone should read this thread https://t.co/irYAT5nQNj
884408202636345344,2017-07-10 13:45:21,HebHousing,Everyone should have a safe &amp; warm place to call home &amp; I'm delighted our investment has helped to make #affordablehousing #KevinStewartMSP https://t.co/Jd4YyD6HxT
884393092953931776,2017-07-10 12:45:19,eustaceily,everyone should read my tweets with Nee-chan's voice
884378006499639296,2017-07-10 11:45:22,OkaOdu,Everyone should read this. https://t.co/aUcMLa1K0H via @intelligencer
884362897186369537,2017-07-10 10:45:20,notnande,Everyone should see you in the open
884347806852317184,2017-07-10 09:45:22,Alex_Grey_x,"Everyone should decide their own sexuality, so let me just decide that my 8 year old son is transsexual. https://t.co/kB6XqGlnj4"
884332697450979328,2017-07-10 08:45:19,annakozuki_en,"Everyone should really just be bowing down to my ultimate boobs because… sighs, well just look at them.
…perfection."
884302507521921024,2017-07-10 06:45:21,Flowers_faby,Everyone should watch Colonia on Netflix. It's a badass movie based on a true story and Emma Watson is in it.
884287397839519745,2017-07-10 05:45:19,seigfs,everyone should go follow my bbg @silkjacksonwang because she's an angel ♡♡♡ https://t.co/LwGHkUU7sX
884272305790009344,2017-07-10 04:45:21,Zeframsee,"everyone should read this

When Will Climate Change Make the Earth Too Hot For Humans? https://t.co/Br825snZQT"
884257198141980672,2017-07-10 03:45:19,loverofmusic912,everyone should really check out @julietweybret for so many reasons. she's helped with a lot &amp; is just incredible 😁❤️
884227010746236929,2017-07-10 01:45:22,70_007,Everyone should serve #Islam according to his/her abilities
884211899344211969,2017-07-10 00:45:19,demidevotionxo,everyone should make a reaction video and post it on social media! GET THE SONG EXPOSER ❤️ send me the link to the vid when you make it!! https://t.co/tKL2EWWFsd
884196802706030592,2017-07-09 23:45:20,kkkillmo,Everyone should just unfollow me
884181713022205952,2017-07-09 22:45:22,indy100,Everyone should watch this recording from a meeting on Grenfell Tower https://t.co/0QXqzn1D1Q
884166615931043842,2017-07-09 21:45:22,brianisaiah_,Everyone should hear this song https://t.co/R0ltqjoAx0
884121306219782144,2017-07-09 18:45:20,KarsynElledge3,Everyone should read this. https://t.co/ugNEAGWDpX
884106216518975490,2017-07-09 17:45:22,ChrisLopezLS,Everyone should go and give @CraigGTAV a follow. Is he one of the candidates for Supervisor of Blaine County.
884076004838264833,2017-07-09 15:45:19,shibashibamo,everyone should read birdmen
884060907730423809,2017-07-09 14:45:20,criderschurch,"Everyone should know that Jesus is the first and most important priority in our lives.
#KingdomLife"
884045808714170368,2017-07-09 13:45:20,Sandra_Cole44,Everyone should take this opportunity to visit City Hall to sign the Book of Condolence for Deputy Mayor Pam McConnell. https://t.co/JrcErs9YXI
884015619510738944,2017-07-09 11:45:22,liftcannabis,Everyone should have their own go-to classic #cannabis-infused brownie https://t.co/T3VIvhLIJ9 @WellnessSoldier https://t.co/YC1mUSgwmw
884000516178497537,2017-07-09 10:45:21,imvaishalisingh,"Everyone should smile.
Life really isn't that serious.
We make it hard.
The sun rises.
The sun sets.
We just tend to complicate the process."
883985407787941889,2017-07-09 09:45:19,Crimson_Albino,"Everyone should fear me, number 1."
883970307870007297,2017-07-09 08:45:19,hulldailymail,Everyone should be aware of this. https://t.co/6MQx8HBk7K
883955221264715777,2017-07-09 07:45:22,CoolRaniK,Everyone should compare car insurance to know the right amount #CarInsuranceCompareKiya @policybazaar_in https://t.co/RGThF6gg0S
883940110084984833,2017-07-09 06:45:19,yourfavshooter,everyone should learn how to think outside the box!
883925010485698560,2017-07-09 05:45:19,EraPorn,"Everyone should bangs big arab dick
#bigboobs #bbw #секс #pussylicking #WebcamChick
https://t.co/QAz3RN0K4r"
883894813069787136,2017-07-09 03:45:20,Chickity_Chyna,Everyone should check this out. Her impersonation is on point https://t.co/nDr6M4eima
883879711490719745,2017-07-09 02:45:19,simonetylee,Everyone should watch True Cost before they say anything about my hand made clothing being too expensive.
883864622100496384,2017-07-09 01:45:21,DonnaLGreen1,"EVERYONE should be overly concerned about the Russia attack on our election, power grid and the support Trump &amp; the GOP is giving them!! https://t.co/lAio7GSwqs"
883849516163620864,2017-07-09 00:45:20,_thenamesalicia,Everyone should mind their womb https://t.co/zhD4zPUCDX
883834411661250560,2017-07-08 23:45:19,Bijouxthecat15,Everyone should compliment my beautiful fuzzy cat face #facts #FactCheck #FactsAreFacts
883819314754633728,2017-07-08 22:45:19,MajesticMusonda,Everyone should follow the main man @stupnama4 . Doesn't have many followers but elite football analysis and opinions.
883804214614302720,2017-07-08 21:45:19,caffejnated,"EVERYONE SHOULD MAKE AN IMVU ACCOUNT BECAUSE YOU CAN DRESS UP YOUR MODELS AND HANG OUT WITH GROUPS OF PEOPLE AND CUSS, DANCE, FUCK #openrp"
883774014455336960,2017-07-08 19:45:19,nicholenordeman,Everyone should have a cheerleader like @theboyonthebike. ❤️ https://t.co/FRc4xmrlJV
883758926314917888,2017-07-08 18:45:22,jseakle,"Everyone should read #2, by the way. It's really really good. https://t.co/G0smUAL6Qv"
883728715481456640,2017-07-08 16:45:19,The_NewArab,Everyone should have the right to express their love - except in the Middle East https://t.co/IOI0XO96Qy
883713628242796544,2017-07-08 15:45:22,sehuntics,everyone should listen to god jaehwan's legendary performance
