905547486470725632,2017-09-06 21:45:19,swilkftme,everyone should see this beautiful music video by @sammywilk  https://t.co/kxv377XAos
905517289637797889,2017-09-06 19:45:20,babs2you,everyone should re listen to this... Mother Earth Speaking https://t.co/wNv7rtFVRI
905502207046336513,2017-09-06 18:45:24,ntblmncereus,Everyone should read this!  End DACA &amp; DAPA it's not a dream act it's a nightmare! @USAGSessions #MAGA https://t.co/VXput5SjgS
905487115982479361,2017-09-06 17:45:26,EllieSkinner123,Everyone should see this video https://t.co/xxxWLsPd6p
905472013463982081,2017-09-06 16:45:25,samb058,everyone should get zello this shit live af
905456900099026944,2017-09-06 15:45:22,Meleah_Joy00,Everyone should watch this. Talent doesn't get you anywhere without putting in the time and hard work ethic. Don't be realistic https://t.co/i15iGB1UUW
905441800885862401,2017-09-06 14:45:22,aalyssa_rae,Everyone should have a friend like Spencer Reid
905426701768835072,2017-09-06 13:45:22,Lil_Tracker,Everyone should check this out!! #safety #baby #babysafety #carseat #carseatsafety #BabySafetyMonth https://t.co/AnrYfy7Jt0
905411606573596672,2017-09-06 12:45:23,_MiloEV,Everyone should just point their fans at the hurricane to blow it away smh
905396503878877186,2017-09-06 11:45:22,redblissdesign,Everyone should get 50 bars of gold for 50 years of marriage. https://t.co/HYuzcP6EfS
905381404254527490,2017-09-06 10:45:22,MioHiroshimo,"Everyone should know that there is no part 9, The part 9 that they talking about is jut Araki's first jump Comic, Baoh : The Visitor"
905366292114268161,2017-09-06 09:45:19,masmona__,everyone should watch it bcs it happened in our country to - the very real horror of child abduction for cheap kicks
905351193244741632,2017-09-06 08:45:19,JonathanEilbeck,"Everyone should watch this video now.
No matter who you voted for you should watch this. Now.  https://t.co/FyRboFBqyC"
905336091279896577,2017-09-06 07:45:19,nadzique,Everyone should read 'Tuesdays with Maurie' by Mitch Albom.
905321004620271616,2017-09-06 06:45:22,KaabilMunda,Everyone should watch this a great music #DilSeKashmir @DilSeKashmir https://t.co/vs6kC9eFu2
905305899505512457,2017-09-06 05:45:20,emilyoneil99,Everyone should envy Nick Pitera's vocal range.
905290796819206144,2017-09-06 04:45:20,clarkbentmusic,Everyone should use military time
905260594541899776,2017-09-06 02:45:19,_alecrespo,everyone should read this!!!! https://t.co/JBlSXi9h6s
905245507219480576,2017-09-06 01:45:22,emiDelane,Everyone should go check out our YouTube channel!!! Link in bio😁😁
905230409314611200,2017-09-06 00:45:22,J2JPlays,Everyone should have pets❣🔴 J2J https://t.co/ATTb2tAv3A
905200196836933632,2017-09-05 22:45:19,PeskyRattigan,Everyone Should Hear #2752: Strange Fruit by Billie Holiday
905185101637607426,2017-09-05 21:45:20,jessicazacher24,"Everyone should be watching Preacher, the shows amazing! https://t.co/xvGeHIyQAu"
905170011970387968,2017-09-05 20:45:22,Taylor_May113,Everyone should definitely go like their new video❤️❤️❤️😂😂@GraysonDolan  @EthanDolan https://t.co/KLGn8mDKF0
905154899582771200,2017-09-05 19:45:19,drugssavemylife,"Everyone should listen to this cover, it is wonderful, @ashleytisdale and @iamfrench  voices are heaven 💙
https://t.co/3IzZmjRby2"
905139800163749888,2017-09-05 18:45:19,ally_bradley2,Everyone should watch this https://t.co/gX4vm3QgkP
905109614026301440,2017-09-05 16:45:22,penguin98x,"Everyone should go watch this amazing video by @BlackeyedxBlond don't forget to subscribe and like this video.
https://t.co/Qw4nSqMIKW"
905094511579226112,2017-09-05 15:45:22,caesarlester,Everyone should hear Karinna tell her beanbag story live bc it's the funniest thing
905079416350314498,2017-09-05 14:45:23,StevenHiscock,"Everyone should get Wednesdays off, just to break the week up so we can all catch up on sleep💁🏻‍♂️"
905049196964716545,2017-09-05 12:45:18,SimplyShimada,"Everyone should remember 2005 hurricane season. Brutal.  Started with Katrina, then Rita... then Wilma.

Each one was 2-3 weeks apart"
905036617206849537,2017-09-05 11:55:18,KaiterEnless,Everyone should read this as there is a significant portion of the US population who wants these repressive measures instituted here. https://t.co/d8uUK5jBIo
905034105858867200,2017-09-05 11:45:20,JBeattie24,Everyone should have to do atleast 1 year working in customer service to learn how to treat people! Do some people not hear themselves 😨
905019003281694721,2017-09-05 10:45:19,Uncle_JayB,Everyone should familiarise themselves with google earth incase they are kidnapped and they can find the location and report where they are
904988829555109889,2017-09-05 08:45:25,itscalkemp,"Everyone should know this anyway, so many clueless drivers out there 😪 https://t.co/wABRm3fK6c"
904973703703879682,2017-09-05 07:45:19,TravisDurden,Everyone should watch this from @FYF_Charity @CorHutton https://t.co/hJ44PG8zxV
904958618952282114,2017-09-05 06:45:22,Shubh__03,Everyone Should watch this fabulous video Of this teachers day by @msdhoni &amp; know how to  #GiftAHabit https://t.co/DD2bxZYDWa
904943507059613696,2017-09-05 05:45:19,laceliteracy,everyone should make a masterlist of something they like. my stem heroines in romance is still one of my favorite posts. it's so satisfying
904928418260705281,2017-09-05 04:45:22,nugent_alex,Everyone should go follow @BarstoolMOState
904898219112521728,2017-09-05 02:45:22,nicolehuff67,Everyone should be watching all her YouTube videos she's such an amazing lady ❤ Everything she does is just for us the viewers https://t.co/IHMRgZtCdO
904883110151462912,2017-09-05 01:45:20,antisocialclubx,everyone should take some time and appreciate this beauty https://t.co/V2VF555Yzp
904868010334183424,2017-09-05 00:45:19,queenozymandias,Everyone should follow @PPKeystone immediately for primo gif usage and info on all the dope shit we are doing with our partners. https://t.co/RFdou7ogHC
904852902941835266,2017-09-04 23:45:18,oefoif0506,Everyone should retweet this where are our military family let them know at  @JohnMcCain https://t.co/2MQGrneMeq
904840320545783808,2017-09-04 22:55:18,kenialachula2,Everyone should be taking a full tube or Airborne before #Delpo comes back to the locker room. 🤷🏻‍♀️😂😂😂#Usopen
904837821357187073,2017-09-04 22:45:22,THEREALJEWS,"Everyone should #invest ! The value might drop but atleast your money didn't go to fast food, liquor or drugs 😶"
904822720218619904,2017-09-04 21:45:21,shah,Everyone should do this. Reevaluate the value any app provides vs. the amount of time you sacrifice to it. You have one life. https://t.co/lEuV4jNrv1
904807612788629504,2017-09-04 20:45:20,lizzy_christ,"everyone should take time out of their day to watch these, you won’t regret it https://t.co/Wugv3hAhu0"
904792523054342149,2017-09-04 19:45:22,BasedJ_,everyone should know this https://t.co/kaHswY9O0Q
904777421869559808,2017-09-04 18:45:21,strawburrylupe,everyone should listen to speak low if you speak love
904747219554754561,2017-09-04 16:45:21,infiniteroadie,Everyone should go check out #RobynReganSignedTShirt
904732133733711873,2017-09-04 15:45:24,sha_kieran,Everyone should have a strike tbh...
904717025359962113,2017-09-04 14:45:22,jacklyngrizzle5,Everyone should get a hype as Morgan did this day https://t.co/WgYn6rIgn1
904686827465957376,2017-09-04 12:45:22,Ayers111,Everyone should be calmly preparing and updating their plans. https://t.co/ywg1oddBJ5
904656626740715520,2017-09-04 10:45:22,Steely260,Everyone should reject the false idol known as @Guac_del_Taco
904626431711354880,2017-09-04 08:45:23,mrsh091,Everyone should serve #Islam according to his/her abilities
904611327376625668,2017-09-04 07:45:21,etvandhraprades,Everyone Should Participate in  Jala Harathi programme || Minister Devineni https://t.co/HTvbUstlEB via @YouTube
904596219434999808,2017-09-04 06:45:19,SydneyMacias153,Everyone should watch A Monster Calls... it's an absolutely beautiful and real movie... I'm crying I need a hug
904566032789934080,2017-09-04 04:45:22,samgardner_4,Everyone should go to https://t.co/ktZWi6MxgP it will make you laugh your ears off
904550920196825088,2017-09-04 03:45:19,cabellobloom,everyone should suffer with me https://t.co/fDZwMMUrN7
904535829070020610,2017-09-04 02:45:21,BobblHeadLives,"Everyone should be doing this, the cone business should go out of business. #cats https://t.co/k9EmW6GfYa"
904520732943589376,2017-09-04 01:45:22,Tidmarsh2032,Everyone should thank Unions for #LaborDay.
904505633709334528,2017-09-04 00:45:22,skylarrr8,everyone should make this their avi https://t.co/GJE9MKqGsz
904490523234156545,2017-09-03 23:45:20,thepaulmerrell,Everyone should eat an orange a day! Orange you glad I told you that?
904475421936201728,2017-09-03 22:45:19,caribelli,Everyone should take a shot rn. https://t.co/YclpTuW9B2
904460333833531392,2017-09-03 21:45:22,ActivistActive,Everyone should watch #Unacknowledged on Netflix. It's time for change.
904430145351540737,2017-09-03 19:45:24,ewan_watkins,Everyone should watch I Daniel Blake. Put it on itv tomoz instead of the England game imo
904415034901532672,2017-09-03 18:45:22,New_Harmonies,Everyone should have been streaming #HeLikeThat all weekend long  https://t.co/hQitf7U7Lu
904399935751168000,2017-09-03 17:45:22,IndycarUK,"Everyone should try &amp; go to Watkins Glen once in their lifetime, you can also tie in a trip to Scranton FOR NO REASON WHATSOEVER! #TheOffice https://t.co/dHN20740ZT"
904384838383263744,2017-09-03 16:45:22,herunlikelyname,"Everyone should take a knee for the loss of our democracy and once-American values, at this point. https://t.co/pFToVqdV2J"
904369736481357824,2017-09-03 15:45:22,saveme_namjoon,everyone should stop giving bighit ideas wth
904354636290605058,2017-09-03 14:45:22,dustinandlucas,everyone should get their stranger things stuff at totally good time i love them
904339527736541184,2017-09-03 13:45:19,JayField24,Everyone should be offended or convicted by sermons not just a single person or people groups. If your shoes aren't getting stepped on leave
904324437767360512,2017-09-03 12:45:22,Feliciatjee,Everyone Should report this!!! https://t.co/QcWtitFsEu
904294241366446085,2017-09-03 10:45:22,logannraj,Everyone should know about you every single person who knows you should know the real you haihh
904279138676072448,2017-09-03 09:45:22,Itzz_Gavin,Everyone should watch this😔💕 @lifeaseva thank you so much for making a video talking about something this personal😥💜 https://t.co/OWrkv0l3dt
904264030130278401,2017-09-03 08:45:19,mikejones__,"Everyone should watch the Spain v Italy highlights from last night, or the Isco game as it should be called 👀 what a player ⚽️"
904248930501771264,2017-09-03 07:45:19,ShinyCactusBean,Everyone should be able to live with their true love one day &lt;3 https://t.co/9L52dNNK2Y
904233822807441408,2017-09-03 06:45:17,PriyankSingh20,"Everyone should read this..
@AamAadmiParty
@AAPGovt4Delhi
@LtGovDelhi
@ArvindKejriwal
https://t.co/XlHUmbMeMV"
904221243225776128,2017-09-03 05:55:18,janemerrick23,Everyone should do this - if you don't want your tweets/photos being used unfettered/uncredited by third parties https://t.co/oDEf3sCmYT
904203630084931584,2017-09-03 04:45:19,rewilson80,Everyone should watch this and grow up To be patriotic doesn't mean to call each other names &amp; degrade one another. https://t.co/v5Ob4i1aiQ
904188545652342784,2017-09-03 03:45:22,oohjazy,Everyone should see you in the open
904173441938464768,2017-09-03 02:45:21,ronnyobrien,Everyone should watch this https://t.co/eUDAKZdBNR
904158343190667264,2017-09-03 01:45:22,Igbtvaltersen,everyone should have a glenna in their life
904143246376353792,2017-09-03 00:45:22,JamesMcCann98,Everyone should strive to be more like @kaylizhug
904128144059260928,2017-09-02 23:45:22,changdeol,"Everyone should report this account tbh. GFriend wouldn't claim such fans, either. https://t.co/sspHEzAwzg"
904113032715833344,2017-09-02 22:45:19,TheHassgropper,Everyone should follow this talented sheep. ;) https://t.co/sJ0SJK3mVu
904097949008801792,2017-09-02 21:45:23,alexandria__lex,"Everyone should hear kylan sing the part ""&amp; I love my giirrrlfriend"" in the song ""I love this bar"" while he's drunk to @laurenbrister . 😍😭❤️"
904082853390016513,2017-09-02 20:45:23,_heyemuhlee,Everyone should really listen to this https://t.co/pVJ3rz5AYE
904067745020383232,2017-09-02 19:45:21,sabpangilinan_,everyone should feel appreciated 😢
904052634432159744,2017-09-02 18:45:19,christrader1286,"Everyone should watch this video at least once, For the Knowledge and Awareness.

https://t.co/jUfofZkb3e"
904037549122785281,2017-09-02 17:45:22,BryceHuber02,Everyone should watch Unacknowledged on Netflix
904022448642826241,2017-09-02 16:45:22,Rich__,"Everyone should watch ""Banking on Bitcoin"" on Netflix if you are interested and wanting to know more about $BTC and cryptocurrency"
903992252501917697,2017-09-02 14:45:23,drbvrmd,Everyone should try this out! In 10min I had contributed hours worth of data for #dementia #VR research! @ARUKnews https://t.co/poFeOv0kB2
903977152634281985,2017-09-02 13:45:22,itskentuckyy,everyone should respect women PERIOD !! https://t.co/VfmIyImeVY
903962050920988672,2017-09-02 12:45:22,MademoiselleT,Everyone should have a skit like this about themselves that they perform in the mirror daily. https://t.co/EoHUc8Mh8G
903946953066549248,2017-09-02 11:45:22,_SarahEIizabeth,Everyone should definitely check out @PaintedLadyCo and her etsy. I'm actually in love with my shirt! 🔴⚫⚪ https://t.co/vgwj2U48s7
903916756716077056,2017-09-02 09:45:23,OchelleJNR,"Everyone should lose,they grow in wisdom....now I know why Raila has been wise ALL these years. Keep it up Gov.Kabogo. https://t.co/pSVT1Lqz33"
903901643363704833,2017-09-02 08:45:20,WRXWesten,Everyone should see this film if you like a good film. https://t.co/FYxaCkjf4t
903886543529549824,2017-09-02 07:45:20,JamesMadeley,Everyone should watch @itsanitarani programme on the partition of India. Should be on core syllabus in UK schools. Get it on @BBCiPlayer
903871443779313668,2017-09-02 06:45:19,EvansGnius,"Everyone should smile. Life really isn't that serious. We make it hard.
The sun rises.The sun sets.We just tend to complicate the process."
903856353034231808,2017-09-02 05:45:22,ZachWritesStuff,Everyone should read War Porn by @RoyScranton for its dark/depressive realism. Also be surprised how much you learn about US military blundr
903841256882634752,2017-09-02 04:45:22,NatalieWalker_9,Everyone should be using witch hazel face wash/toner 🙌🏼
903826156855508994,2017-09-02 03:45:22,DSlisz,Everyone should have this mindset https://t.co/GLbEpzeFyE
903811047017943040,2017-09-02 02:45:20,knobsywob,everyone should get out to a daca rally near you this labor day weekend https://t.co/gkVhjoEDsZ
903795944558215168,2017-09-02 01:45:19,thevampsgabbyyy,everyone should go leave @justinnsplanett a nice message for when she wakes up!! it would really make her smile and I want her to smile!
903780855088340994,2017-09-02 00:45:21,namidacchi25,everyone should see the boo to you parade atleast once in their lives...
903750659198947328,2017-09-01 22:45:22,TheyCallMeSam2,Everyone should be tuning into the USA vs. CRC World Cup qualifying match on espn
903720445190430720,2017-09-01 20:45:19,_tomwilloughby,"Everyone should stay in, save gas, let them restock, and watch Narcos season 3! #Narcos"
903705348254531584,2017-09-01 19:45:19,dantronlesotho,Everyone should check out this game; I played it last PaxEast and had a great time https://t.co/DfrN7aUaYN
903690267890302976,2017-09-01 18:45:24,AlienDad420,everyone should get an hour for lunch
903660047594430464,2017-09-01 16:45:19,heatherlamsey,Everyone should give this amazing EP a go! https://t.co/Sc4rpmx5yH
903644973253275649,2017-09-01 15:45:25,shamoy_x,Everyone should watch the movie freedom writers.
903629852154109953,2017-09-01 14:45:20,TheCryptoPros,"Everyone should follow @BlockchainGains
This guys knows so much about #Cryptocurrency"
903614763749347328,2017-09-01 13:45:22,POWER_mp3,"EVERYONE SHOULD WATCH Dowithlove EXO theory ""WARNING- RF_05 EXPLAINED"" from his/her youtube channel. *GOOSEBUMPS* *SHIVERS*"
903599664292757504,2017-09-01 12:45:22,SoulKissesTV,Everyone should not have access into your heart. For it is the spring from which all flows. #BecomingLoveProject
903584555415650305,2017-09-01 11:45:20,chyprashant,Everyone should must watch this amazing story of Women of Biriya https://t.co/05GtGGGsSQ #ReelToReal @MKBKSH_ @PFI3
903569462808285184,2017-09-01 10:45:22,ElectrifyingWWE,Everyone should definitely check out these films. Very inspiring. @MKBKSH_ #ReelToReal https://t.co/SuhwfHFSnD
903554374193971202,2017-09-01 09:45:24,Mr_Dr0ne,Everyone should  seriously consider investing in this game. It looks very promising. https://t.co/kC6dsZSudZ
903539266935939072,2017-09-01 08:45:22,kyaprimus,Everyone should watch suits the girls are badass n only wear louboutins 😍😂
903524162873958400,2017-09-01 07:45:21,loricousin,Everyone should eat less meat whatever. How did I not know they kill the calves of dairy cows for our milk and veal? Try Alpro drinks. Tasty https://t.co/nq7MSoTgNN
903509066462273540,2017-09-01 06:45:22,JamalDajani,Everyone should pitch in https://t.co/L45xfwys7y
903493968779919361,2017-09-01 05:45:22,ireneclipse,everyone should be mutuals with @pngjeon she's so sweet and caring js
903463757468262402,2017-09-01 03:45:19,MuvaDij,Everyone should be progressing in life. Moving forward. Getting better. That's the expectation right?
903448667301994496,2017-09-01 02:45:22,mmkalla,Everyone should have an #epassport by August 2019 ~ CS Fred Matiang'i. https://t.co/sbJfpc6aes
903433567794995201,2017-09-01 01:45:22,Karen0275CLR,Everyone should have a couple quarts of this in their freezer ..... Cold and flu season is right around the... https://t.co/3fcNlHYZo5
903418450042699776,2017-09-01 00:45:17,sharonroney,Everyone should be appalled if this is true. https://t.co/KhIb2nFXTi
903405871803154434,2017-08-31 23:55:18,taekaisspawn,EVERYONE SHOULD REALIZE THIS https://t.co/21aFGY9Yy1
903388280430854146,2017-08-31 22:45:24,monodelufi,Everyone should #StandUp4Medicare for all in 2018
903373160489172993,2017-08-31 21:45:19,claireliontamer,Everyone should go and follow my infinitely more sensible baby sister @Ellaella1995 who starts her PGCE next week.
903358060214620160,2017-08-31 20:45:19,kmallende,Everyone should read Ward's __Salvage the Bones__. https://t.co/slxYL2ywHO
903342975228436480,2017-08-31 19:45:23,MrLeeVaLone,Everyone should be tested for the genetic markers for cancer. I have both for breast cancer- so it's not really a question of if it's when
903327859879567360,2017-08-31 18:45:19,Nitsua_txt,EVERYONE SHOULD WATCH BARAKAMON.
903312760657780736,2017-08-31 17:45:19,The__Squealer,Everyone should watch #Offspring
903297663809892352,2017-08-31 16:45:20,alainaa_0328,Everyone should go fill up their gas tanks today because due to the storm they're shutting down pipelines in Texas. Chances of shortage!
903282559294988289,2017-08-31 15:45:18,kspaonline,Everyone should have a chance to come to our blockbuster fall conference. So we have SCHOLARSHIPS! Apply here: https://t.co/aR0SvaKlAJ https://t.co/xhXyza1uk1
903267483557126146,2017-08-31 14:45:24,BespokeSongs,Everyone should dance round the kitchen to a song written just for them… https://t.co/8UtjUp93BM
903252373539192832,2017-08-31 13:45:22,BPayneMES,Everyone should remember this. https://t.co/ok5NO4xhiF
903237286552154112,2017-08-31 12:45:25,sunburstinnfl,Everyone should read this.  Good advice for all of us who use our phones too much. https://t.co/1yTCwr1uly
903222164274397184,2017-08-31 11:45:19,EGallion27,Everyone should see how fake this woman is. https://t.co/6cdB619G4S
903207074334597120,2017-08-31 10:45:21,bbygyal4lyf,"Everyone should buy juice chargers instead of apple. 2 year warranty. Quick call or email. name and email address, sent out same day. Boom"
903191973955198976,2017-08-31 09:45:21,Rahiq_rons,Everyone should serve #Islam according to his/her abilities
903176874901127168,2017-08-31 08:45:21,SolutionValley4,"Everyone should watch this video at least one time.
Nice message in it. 😊😇🙏 https://t.co/zwV7u825NJ"
903161758994407424,2017-08-31 07:45:17,ShubhamAne,Everyone should go to see Kapaleeshwar Temple in Chennai #SMTDchennai @Panasonic_mob @Pankaj11Rana
903149179333033985,2017-08-31 06:55:18,thaskiara,Everyone should think like this. 💯 https://t.co/07Aq3vqrOo
903131578502545408,2017-08-31 05:45:22,hiphopeseok,everyone should be banned from wearing green the only one who deserves to wear green from now on is jung hoseok
903116477938540544,2017-08-31 04:45:22,DemonXarluxia,Everyone should read this. https://t.co/CW1RsZvkFz
903101381669617664,2017-08-31 03:45:22,B_RADFINGERS,Everyone Should Check Out @Sierra_Bernal 's Music https://t.co/FQT9HbiQj4
903056070204985344,2017-08-31 00:45:19,joey_girardi,Everyone should be for #TaxReform regardless of party. It benefits the United States and alllows us to stay competitive globally. #MAGA
903025872319299589,2017-08-30 22:45:20,jillianbuckalew,Everyone should see these https://t.co/SUs82P5hPd
903010780513148928,2017-08-30 21:45:21,PotoulaA,Everyone should listen to @RaleighRitchie 's music because he is marvelous and uber talented. Please and thank you 😊🙌👍
902995697753927680,2017-08-30 20:45:25,SonnyBunch,"Everyone should see WIND RIVER, it’s quite good. https://t.co/3WGNdZJyuD"
902965486803025920,2017-08-30 18:45:22,IraisAguilar,EVERYONE SHOULD DRESS UP AS PICKLE RICK FOR HALLOWEEN. https://t.co/AfQb4a4Z05
902950393679724544,2017-08-30 17:45:24,shooterlance,everyone should love and appreciate tom holland
902935284215570432,2017-08-30 16:45:22,eggsprinkles,Everyone should like Vietnamese food ok
902920196351860736,2017-08-30 15:45:24,holyshx_,"EVERYONE SHOULD LISTEN TO THIS , THANK YOU @Pink💘.https://t.co/9xESNwubwT"
902905086476615680,2017-08-30 14:45:22,iDuchaine,Everyone should know these vodkas. They are essential. Whisper their names from generation to generation. Venerate these fermented carbs. /s https://t.co/tim8eJqxcm
902889979264679936,2017-08-30 13:45:20,ipg95,"everyone should see how they make their states jungle, then resist others from becoming good.. JUMLA circus https://t.co/sKu8cF69vo"
902874888473518081,2017-08-30 12:45:22,changhyunparker,"Everyone should read ""The Art of War"""
902859786009509888,2017-08-30 11:45:21,nony_garg,Everyone should surely have a look at this movie #BabumoshaiHitbaaz @KushanNandy @Nawazuddin_S
902844687697952769,2017-08-30 10:45:22,icezlemonT,Everyone should be prepared for miku's 10th anniversary.  The hype is on.
902829577919111168,2017-08-30 09:45:19,craig_bates_,Everyone should go see this if they couldn't catch it at the Young Vic! https://t.co/GPOGFaAjvq
902799379660017665,2017-08-30 07:45:19,nicorueduran,"everyone should watch this very moving video
https://t.co/KPPS4ceMIk"
902784301820911617,2017-08-30 06:45:25,rewilson80,Everyone should follow @GOP_Tennessee
902769200606871552,2017-08-30 05:45:24,_MIRIAondawall,EVERYONE SHOULD WATCH THIS MOVIE AT LEAST ONCE IN THEIR LIFE FR FR https://t.co/8qWKSYPrd0
902738992562561024,2017-08-30 03:45:22,picklericck,Everyone should read this! We can't allow this injustice to stand! https://t.co/wKkhpqUT2z via @esquire
902723882221576192,2017-08-30 02:45:19,stoveek,everyone should be watching #TheBoldType https://t.co/nNjyOv1cah
902708790809604096,2017-08-30 01:45:21,Abilityadvoc,Everyone should have the opportunity to live as independently as they desire!We need 2 fight 2 ensure the system allows it #advocacymatters https://t.co/RyQ4jsKGTb
902693692347006976,2017-08-30 00:45:22,LoveTheStew,Everyone should have the opportunity to study and intern in the US. It was such an amazing experience for me 😢
902663483166121984,2017-08-29 22:45:19,Anjucco,Everyone should watch #Kulipari #ArmyofFrogs it's so good!! @netflix https://t.co/iY2bIfoWWi
902648392701972480,2017-08-29 21:45:21,idktoriww,everyone should come out to the swim meet tomorrow at 5:30 against lake highland :))
902633303567622144,2017-08-29 20:45:24,CherrellRene,"EVERYONE should call them and go off. @Regrann from @jmacglobal  -  Wow, this is not the time… https://t.co/61OoWU73xY"
902618193742594048,2017-08-29 19:45:21,Bad__Scooter,Everyone should tune into the @Rockies game tonight and see my friend @ChiefSimonsen and his good dog Yoko throw out the first pitch!
902603098908012544,2017-08-29 18:45:22,garrett_houck,everyone should know that I saw @adam_cessna95 today and it lit up my life.
902588013477113856,2017-08-29 17:45:26,porntagonist,everyone should draw girls fucking bikes so i can torment my friend with it
902575397006581765,2017-08-29 16:55:18,autumnnnleeee,"Everyone should take a second and say a prayer for Texas, they seriosuly need it. I couldn't imagine what they're feeling."
902572895628550144,2017-08-29 16:45:21,YoungusrNick,everyone should kno why u don't play 2k am like this man has a baby ona way he doesn't have time for threats ovr afckn vgame💯@Prettyboyfredo https://t.co/XZtUNfy1gg
902557786772463617,2017-08-29 15:45:19,zhongnyn,everyone should couple dp woth me
902527598428807168,2017-08-29 13:45:22,heymagee,"Everyone should be so lucky to have a sister like @shannon_noon - she's all brains, balls &amp; beauty. Happy Birthday, you amazing gal!"
902512500633092096,2017-08-29 12:45:22,guleumy,"everyone should be blessed by this
https://t.co/sL9eDqrErj"
902497401109221376,2017-08-29 11:45:22,sidegirllxix,Everyone should  follow my boy @simon__cole 💗
