896457601302396929,2017-08-12 19:45:22,wcharaf,"Everyone should know this factual timeline and stop saying anything that contradicts it:

13.8B years ago: Big Bang
4.5B years ago: earth f…"
896442490525409280,2017-08-12 18:45:19,JamMusic13,Everyone should decide to come move to Atlanta. #bemyfriend
896427391605551104,2017-08-12 17:45:19,livhulling,Everyone should check out @toddcarey 's album #futurethrowback it's a great album! Love every song!
896412293595930624,2017-08-12 16:45:19,hershyomouth,"Everyone should just be allowed to carry swords and bows since we are so hell bent on being able to ""protect ourselves"""
896397201546420224,2017-08-12 15:45:21,taylorameredith,Everyone should read this thread https://t.co/7zSyNgg2qK
896382105298452482,2017-08-12 14:45:22,CEFan4Ever19,Everyone should know better than to expect any kind of condemnation from @realDonaldTrump about #Charlottesville. It doesn't fit his agenda.
896367004663267328,2017-08-12 13:45:22,emily199_,Everyone should be nice to each other
896351902924816385,2017-08-12 12:45:21,dumbbugallie,"Everyone should appreciate @NiallOfficial little tummy, its so cute ! #NiallsTummy https://t.co/OmMMajQGTW"
896336803799605249,2017-08-12 11:45:21,bjm262run,"Everyone should have fast home Internet and mobile access, commenters tell FCC https://t.co/IKXIXzreH1"
896321704506478592,2017-08-12 10:45:21,NginyaDiyu,Everyone should be calm https://t.co/yx8soGglgi
896291508986368000,2017-08-12 08:45:22,wofayaw24,"Everyone should watch out for @LFC attacking trio, Mane, Sallah, Firminho. Pace and Power 💪💪"
896276408963551232,2017-08-12 07:45:22,getlikedia,Everyone should watch blackish #dailytweet
896261295963480064,2017-08-12 06:45:19,rcollins27,Everyone should own a pair of pajama pants with pockets
896246208464732160,2017-08-12 05:45:22,modipreksha,"Everyone should definitely do this for our martyrs.
Time to take the #iDPledge @IDFreshFood.
https://t.co/kVcre5ZK7R"
896231108865433600,2017-08-12 04:45:22,chyprashant,Everyone should watch it. This is too much patriotic .#TheLastMinuteSmile https://t.co/xkvi1573hA @whiteforcemp
896215996553240576,2017-08-12 03:45:19,alelevine,Everyone should add Fernando on snap rn LMAO
896200909889314816,2017-08-12 02:45:22,Apollo_Husky,"Everyone should go listen to @RiotTenMusic song Rail Breaker ft Rico Act like right now!! #HeadbangersBeReady

https://t.co/8xShc0zVBW"
896185798600544256,2017-08-12 01:45:19,salemsaeed4342,Everyone should serve #Islam according to his/her abilities
896170710506262528,2017-08-12 00:45:22,BradleyEOwens1,"Everyone should take a gander at this and ask themselves, do we want a nuclear armed North Korea to develop... https://t.co/hjfct3j4oS"
896155611611582464,2017-08-11 23:45:22,nicoleatone,Everyone should just sit back and let the Baratheons kill each other. #GameofThrones
896095203370475520,2017-08-11 19:45:19,xjetblack5sosx,Everyone should go check out @HeyViolet new video Hoodie!! It's amazing!  https://t.co/Xh0oLoUxmD @renalovelis @NiaLovelis @MirandaMiller
896080114177368064,2017-08-11 18:45:22,Scottlfc87,Everyone should pick arms folded and not try to stand out like a dickhead
896034804268900352,2017-08-11 15:45:19,jenn_raye,"Everyone should have the opportunity to try this at least once. I didn't have a safe, nonjudgmental environment to do this until college."
896019719383166976,2017-08-11 14:45:22,cerian_clarke,Everyone should follow @AlexKWLangport because she is amazing!
895959309305217024,2017-08-11 10:45:20,MrsFranzPE,"Everyone should b following @thebradmontague - if you're not, check it out.Thanks @KingRoom5 for the morning encouragement from his account!"
895944208913014784,2017-08-11 09:45:19,ScampsOldham,Everyone should be catered for in public conveniences not just toilets but council buildings and council run... https://t.co/UdzScgeZBF
895929119589900292,2017-08-11 08:45:22,TBIF,Everyone should have a home https://t.co/J015DYIUFb https://t.co/2RkpnzU0tn
895914018136666112,2017-08-11 07:45:21,IhiruRoy,Everyone should support this wonderful movement at Jantar Manter on 14th August. #AzadiFromPatriarchy https://t.co/rGoFN64CIq
895898921599287296,2017-08-11 06:45:22,JoeyMcFarland,Everyone should see this! https://t.co/hpSsMeryLv
895883825254776833,2017-08-11 05:45:23,xShannon_HBx,"Everyone should go and buy @JessieJ 's new single 'Real Deal' as her first single in ages we need to get it to #1
https://t.co/drjLofUaPO"
895868724581814272,2017-08-11 04:45:23,NicotineAmy,Everyone should listen to this bop by @carliehanson  https://t.co/duDTrfAQG7
895853620775632896,2017-08-11 03:45:22,VTRamos,Everyone should check out the moon right now
895838509981851648,2017-08-11 02:45:19,michael_zecca,Everyone should have to watch Hacksaw Ridge and see who a real hero is
895823423250735104,2017-08-11 01:45:22,Jcruz51500,Everyone should be this happy with life @tommychong https://t.co/XDBnE3R5Su
895808313492873216,2017-08-11 00:45:19,MorganSpurlock,"Everyone should do themselves a favor and read the reviews for it on @RottenTomatoes, they're pretty magical https://t.co/PN3d7JYsWN"
895793225083912192,2017-08-10 23:45:22,heyjenbartel,Everyone should try drawing! At least once! Especially comic writers! And comic critics! 😇
895778123781857281,2017-08-10 22:45:22,Chantelle_Disco,"Everyone should have a drunken, depraved 20-something on speed dial for Thursday night entertainment."
895763025856053248,2017-08-10 21:45:22,JuleLmn,EVERYONE SHOULD APPRECIATE CALUM
895747924214202368,2017-08-10 20:45:21,emilysdoran,Everyone should try matte nail polish. It's life changing. My life has changed. 😎
895732813315440640,2017-08-10 19:45:19,TeenGirlShout,Everyone should go check out @xxhumberEmmaxx https://t.co/aTGFsGizjC
895717727888855040,2017-08-10 18:45:22,GuapoGab3,Everyone should just stop getting mad at each other okay
895702640054550528,2017-08-10 17:45:25,brobke,"Everyone should watch this series on the NIH Clinical Center.   Unbelievable team and mission!
@Allscripts @NIH

https://t.co/Em8P8mQURP"
895687530200223744,2017-08-10 16:45:22,LI_Learning,Everyone should have a great headshot. Here's advice from a professional photographer on how to take one: https://t.co/XtrW2axNe5
895672425387511809,2017-08-10 15:45:21,Sushant_Kaushal,Everyone should use this https://t.co/tQqJDw6bRZ
895657326811557889,2017-08-10 14:45:21,vijayannamalai1,Everyone should take care themselves... https://t.co/BSXOUWmhjc
895612020661264386,2017-08-10 11:45:20,jhonllwyd,Everyone should see this https://t.co/MRjRXuXB4L
895596919740813321,2017-08-10 10:45:19,Sasha_fierce263,Everyone should check in the yard by 9pm. The landlord would lock the gate thereafter😭😭. https://t.co/FkgcUPsLZY
895581829125648384,2017-08-10 09:45:21,RobaireBeckwith,Everyone should consider what is articulated here - The proverbial plug-hole awaits us (and the rest of #biodiversity) if we take no heed https://t.co/bHz0LH2FoQ
895566730059071488,2017-08-10 08:45:21,dixieschick67,Everyone should check this out. I've lost my brother &amp; a dear friend to this disease in the last 18 months. https://t.co/w0j5rTbgDk
895551631978188802,2017-08-10 07:45:22,Orisdrew,"Everyone should watch Million Dollar Baby.
A chuisle mo chroí - my pulse"
895536533712683008,2017-08-10 06:45:22,Willy_Rozay,Everyone should buy an Anker mini drone they're like $20 and awesome (one w/ controller) #scaryfuturestuff
895506341690621952,2017-08-10 04:45:24,salmanalharbi62,Everyone should serve #Islam according to his/her abilities
895491222243913728,2017-08-10 03:45:19,AdeliaMahaffee,Everyone should seriously have a friend like @maaaddddiiiii !!!
895461041714352128,2017-08-10 01:45:23,spacerobotfeels,"Everyone should,, kiss op's mask afdfhg"
895445933688737793,2017-08-10 00:45:21,lilneyab_,Everyone should just leave me alone 😇😇
895430836312354816,2017-08-09 23:45:22,ADDYDDARIO,Everyone should look at this its pure gold xx https://t.co/xIMG4Bckb4
895415737732419585,2017-08-09 22:45:22,blaquesvt,everyone should be like paris monbebes https://t.co/tkrdNlBaw0
895385538907185152,2017-08-09 20:45:22,Thequietnini,"Everyone should follow this account, it's hilarious as fuck!! #toofunny #politicalhumor #satire #politicalsatire #ismelania #hahaha https://t.co/2SlAQbk7YU"
895370438947229696,2017-08-09 19:45:22,BradyBacon,"Everyone should go grab a ""We Support about Troops"" shirt! We are donating $5 for every shirt sold to the Purple Heart Foundation 💜 https://t.co/l8tEVJvYUe"
895355339083702272,2017-08-09 18:45:22,MrMimeMrMeme,everyone should know by now i like @KateUpton and think she has a nice shape. what's the ultrimate #kateupton troll? date #charlottemckinney
895340237819334657,2017-08-09 17:45:21,ItsDrxppy,Everyone should just @PrinceTatted https://t.co/QR9zpZO1TV
895310042601111552,2017-08-09 15:45:22,kxxf_,everyone should get a laser printer lmao 1 toner cartridge lasted my family 2 years
895294939805777920,2017-08-09 14:45:22,OurLuckyDogs,Everyone should start the morning with a kiss! We do! https://t.co/lMvvYznPSu
895279830761066497,2017-08-09 13:45:19,ROBSON_THE_RED,Everyone should give this a listen 👀 https://t.co/75W0X1rTdM
895264742045962240,2017-08-09 12:45:22,TeacherTalkTom,"Everyone should see this... the death of the middle classes, the deprivation of the poor, the obscene wealth of few https://t.co/ujQmEpuHuJ"
895219432074629120,2017-08-09 09:45:19,SvetlanaSVK1992,"Everyone should listen to this. And think deeply about lyrics.
https://t.co/JwzAmsSU0R cez @youtube"
895204344215117828,2017-08-09 08:45:22,WearmouthBridge,Everyone should have a walk over me today although there are no banners or streamers. No-one's invited me to a party either 🙁 https://t.co/zyTz5EHecQ
895189244364324864,2017-08-09 07:45:22,jjmello23,Everyone should have to smoke weed 4 times
895174129283997698,2017-08-09 06:45:18,killemterioo,Everyone should watch girls trip
895161548615888896,2017-08-09 05:55:19,dukarerahul,Everyone should learn the discipline from this march started with silence and will end with silence#EkMarathaLakhMaratha #marathamorcha https://t.co/xYfexl7aaS
895159049246961666,2017-08-09 05:45:23,KatieSOnline,EVERYONE should watch the last episode of @TheBoldTypeTV ❤️ Thank you @BoldTypeWriters for these amazing stories. @thekatiestevens 🤗
895143947210604545,2017-08-09 04:45:22,FolkanSpoonent,"Everyone should be losing lives. If you're at 10 I'm questioning you :,)"
895113741141909504,2017-08-09 02:45:20,aqua_rose_97,"Everyone should go subscribe to @baetacus on YouTube.
Her streams are fun to watch!! And she's a super duper close friend of mine. c:"
895098636169732096,2017-08-09 01:45:19,tozierher,"everyone should have a backup plan, especially in a social media type job. you never know what could happen https://t.co/bT11j6ULDA"
895083537820299265,2017-08-09 00:45:19,AmericanLungDE,Everyone should have a yearly check-up – including kids with asthma. Check in with your doctor before school starts! https://t.co/qNYaa6OUl8
895068439038971906,2017-08-08 23:45:20,louise_calvert,Everyone should watch Old People's Home for 4 year olds 😭😭😭
895053338739228672,2017-08-08 22:45:19,colleensglitter,everyone should go watch @ColleenB123's new video. such an important video and @Korsoto is the bravest human alive. https://t.co/57DMCwKTHZ
895008041254268928,2017-08-08 19:45:20,abbeypoms,Everyone should go watch the show Catastrophe. You will not regret it.
894992966208471040,2017-08-08 18:45:25,Investments_Tip,"Everyone Should Know These Simple Forex Strategies -

https://t.co/aQd5CGyBjZ via @Investments_Tip

#investment #gold #Stock #Real ..."
894977852226945024,2017-08-08 17:45:22,YogaTherapyMcr,"Everyone should have a yoga matt. Here's mine.

#yogisofmanchester https://t.co/sMI4lqdhaU"
894962753500102658,2017-08-08 16:45:22,TomC9740,Everyone should hate @LozzoMamo
894947639476666368,2017-08-08 15:45:19,actuallyondirt,Everyone should take a min to check out the amazing video pieces that @yakubfilms @ElijahAlvarado and crew did for @lollapalooza. Incredible
894917453335089152,2017-08-08 13:45:22,vulnerablefeels,everyone should remember that before you don't let go something old you can't get anything new
894902352032874497,2017-08-08 12:45:21,AsToldByShae,Everyone should read The Power of Now..#lifechanging
894887244137287680,2017-08-08 11:45:19,SC_HS_FB,"Everyone should look at that chart: Our Broken Economy, in One Simple Chart https://t.co/pp1GZYADZN"
894872154851782656,2017-08-08 10:45:22,W1lsonDr,Everyone should use #cannabis https://t.co/LSiMoGbBWT
894857055277731840,2017-08-08 09:45:22,barbgamm,Everyone should read this https://t.co/xeLmldWrtM
894841947965149184,2017-08-08 08:45:20,ProgrammingLng,"Everyone should know how to program a computer, because it teaches you how to think!"
894826856674807809,2017-08-08 07:45:22,actual_vortex,Everyone should go to @Tate MODERN to worship in the Betye Saar shrine room. https://t.co/f0Bi5Jyd9n
894811757046145026,2017-08-08 06:45:22,Canadiansparty1,"everyone should be united
for women's rights
not to be subjected to this Treatment

Get on board https://t.co/Pr2Qu080Z7"
894781547923988482,2017-08-08 04:45:19,TGreatB,everyone should try Duolingo for their language classes 😳
894766445648691201,2017-08-08 03:45:19,soytanialeon,"Everyone should go watch ""The Girl in the Book"" on @netflix It's so amazing and eye opening. I'm speechless 👏"
894751362621218816,2017-08-08 02:45:23,andreaketchum,Everyone should read this to comprehend the extent of the weirdness at Google. https://t.co/VN3ka36hrF
894736259930771458,2017-08-08 01:45:22,msfranalove,"Everyone should watch ""we're not broke"" on Netflix"
894721159949713408,2017-08-08 00:45:22,ziadtheactivist,"Everyone should take this.

These are impossible measures, and this makes no one safer.

https://t.co/RKUdQh2xDK"
894706059255750656,2017-08-07 23:45:22,continenthop,"Everyone should go to Santorini, it's amazing. Here's how we did it on a tight budget! https://t.co/w61KysIfU0 https://t.co/dAmQ5txpMV"
894690962537984001,2017-08-07 22:45:22,phillygirl19121,Everyone should take this.                                                        https://t.co/XMpcuVoGA6
894675862242476032,2017-08-07 21:45:22,cuteyifan,everyone should dm bambam to tell yugyeom to let him know that im here if he ever want to get his ass eaten
894660776258031617,2017-08-07 20:45:25,SPYderman233,Everyone should give this a listen. The build up to the song is god tier. @yakuzagame @YakFan  https://t.co/jlI5hHPiBG
894645661282455552,2017-08-07 19:45:22,d_pd123,"Everyone should watch this.

Procter &amp; Gamble: 'The Talk'| Ad https://t.co/64OlnN27ub"
894630563935428608,2017-08-07 18:45:22,alexandralynnn_,"Everyone should really listen to @PostMalone's cover of Bob Dylan's ""don't think twice, it's alright"" it's magical"
894600364841877504,2017-08-07 16:45:22,kjongdaeri,everyone should be more like princess
894585269252349952,2017-08-07 15:45:23,seaveysins,everyone should def follow @WDWIlluminati if you want to know the truth
894570165446164481,2017-08-07 14:45:22,BO55MAN_,Everyone should watch @wthfilm (#WhatTheHealth)
894555065305911297,2017-08-07 13:45:22,N2014v,Everyone should serve #Islam according to his/her abilities
894539965941432321,2017-08-07 12:45:22,LaetitiaLauryn,Everyone should watch this https://t.co/JbaLdTl8JD
894524866505850881,2017-08-07 11:45:22,CranstonJillian,everyone should go see @PPumpalot my two loved it https://t.co/Fp4qDLmmQV
894464468805074944,2017-08-07 07:45:22,21madisonbrooke,Everyone should have a friend like @MsCaitelynRose
894449369239375872,2017-08-07 06:45:22,xavieruzor,Everyone should reflect on this today https://t.co/l3RQ45t1eg
894434263449223168,2017-08-07 05:45:20,Puspalata25,Everyone should be a part of this safety campaign. #GiftAHelmet https://t.co/F1xyClKEgN
894419168404963328,2017-08-07 04:45:21,caseyfields1513,Everyone should go watch the detriot movie
894404057367891969,2017-08-07 03:45:19,MelissaBHill,Everyone should watch the video in this link. #loveislove https://t.co/ktVelmLA22
894388971098198017,2017-08-07 02:45:22,AboHuthifa,Everyone should serve #Islam according to his/her abilities
894373869301055488,2017-08-07 01:45:21,BearingMoon,Everyone should be pulling a Reek right about now. #ThronesYall #NoConfederate🚫
894358773120106496,2017-08-07 00:45:22,SofiBorbon,Everyone should watch this 👇 https://t.co/TnkvGIIAgr
894343673990725632,2017-08-06 23:45:22,anngelaalee,Everyone should go check @FaZeApex video out! https://t.co/pjWfeVOWwr https://t.co/ITyM0C34XY
894328575532253184,2017-08-06 22:45:22,dawnk777,Everyone should get ta vote.  @RepGrothman https://t.co/BFXsaC6TEF
894313463903698944,2017-08-06 21:45:19,ScottHallMU,everyone should listen to these words https://t.co/xtpgKDHEVs
894283273399971841,2017-08-06 19:45:22,toozdee,Everyone should have an dog like #charliemurphy #bestdog #chocolatelab #olddogsrule #dogsoftwitter https://t.co/KKH3EIY2zp
894268175843328000,2017-08-06 18:45:22,ftoliverlee,everyone should go download Axolotl rn it's so cute i love it so much
894253063929835521,2017-08-06 17:45:19,Travelnpack,"Everyone should use 1 text app. I don't care which one. I have to use FB Messenger, Viber, and Whatsapp. Now need to add Snapchat. 😬"
894222866165538816,2017-08-06 15:45:19,EmmxxNeoma,EVERYONE SHOULD SPOIL LAV FOR THEIR BIRTHDAY ! https://t.co/dKj88eaGSs
894207767350722562,2017-08-06 14:45:19,1ElenaAltman,"EVERYONE should read this before making up their mind... oh and yes, I'm an asshole sometimes to people that... https://t.co/z3w6v92vL4"
894195178503774208,2017-08-06 13:55:18,M1NSEOKI,everyone should read this!!! 👇🏼 https://t.co/rLl3vYrkIL
894192667805884416,2017-08-06 13:45:19,TheBucketShopX,Everyone should have to take this test. Problem solved. https://t.co/JuncFeXxgl
894177564331130880,2017-08-06 12:45:19,Lcambo91,Everyone should watch What The Health on #Netflix #whatthehealth
894162467089039360,2017-08-06 11:45:19,Shubh__03,"Everyone should Spread the message which is in this great video.. let's take pledge
#MoretoGive
https://t.co/z2gthZOWpq"
894147366353199105,2017-08-06 10:45:19,Andronious,Everyone should listen to Smokey Robinson at least once in their life
894132279672422400,2017-08-06 09:45:22,padgettzachery,Everyone should know their parents. It breaks my heart to see people who have never met their birth father or mother.
894117178777018369,2017-08-06 08:45:21,jugaaduNo1,"Everyone should do their bit to save the humanity
#MoretoGive
https://t.co/zQ0JOsXwiJ"
894102083288276993,2017-08-06 07:45:22,armytoot,"Everyone should stop the hate on ""saranghae girl"" please. For those only who know her. And for those who don't, it's okay for the best."
894086979511435264,2017-08-06 06:45:21,Lisa_Dels,Everyone should give this a read. Life-changing. #GrowthMindset https://t.co/9hKC1sHuiD
894071879681531904,2017-08-06 05:45:21,neymartrash,everyone should watch her vlogs (i tell her what to say in all of them) https://t.co/oX7emyf8TQ
894056781868965889,2017-08-06 04:45:22,baegopateam,everyone should stop being so salty towards wannaone i mean who tf would argue over colors
894041683574181888,2017-08-06 03:45:22,BlindNewsGirl,"Everyone should read up on this if they haven't. When you learn just what those bombs did, it's horrifying!  https://t.co/NPXFeT8vQ8"
894026585665191936,2017-08-06 02:45:22,cmhanusz,Everyone should aspire to be drunk me 😁 https://t.co/TQP24ubSer
894011486095368192,2017-08-06 01:45:22,MarkIHarrison,Everyone should. It's majestic. https://t.co/7zz0SkdQHW
893996381760667649,2017-08-06 00:45:21,LuchoBernal_,Everyone should go see snapchat's story Good Luck America.. 2 minutes of your day to inherit some knowledge.
893981282937454592,2017-08-05 23:45:21,itsyoumorrison,everyone should watch lucifer because is such an amazing show with an amazing cast
893966175087939585,2017-08-05 22:45:19,Heshaam72,Everyone should be smoking weed tonight.
893951085529845760,2017-08-05 21:45:22,penguin98x,Everyone should go and watch this great channel and subscribe also click the bell so you don't miss out on future videos @GothicLibrary13 https://t.co/UN2yC1G3Fb
893935983644688384,2017-08-05 20:45:21,shirlh307,"Everyone should be thankful that Obama was able to bring us out of a recession... Trump inherited this ⬇⬇⬇
... Be thankful!! https://t.co/3HxcyVeKhV"
893920884926234624,2017-08-05 19:45:21,Quintanilla94J,Everyone should watch Dear White People.
893905777827565570,2017-08-05 18:45:20,MasonsKnowstone,Everyone should save room for dessert! How enticing does our Strawberry Cheesecake from the A La Carte Menu look? https://t.co/dPiFUgq3nw
893890689884332032,2017-08-05 17:45:22,sb_catcher22,Everyone should know their worth and if people don't respect it that's when you let them go🖕🏽☺️
893875589165105155,2017-08-05 16:45:22,trauncher,Everyone should watch this 1948 cartoon about the dangers of socialism and the awesomeness of America! https://t.co/5CWV79ik0j via @reddit
893860477461159936,2017-08-05 15:45:19,whyanisss,"everyone should know anis is literally the best boyfriend nida could've ever ask for , like sape sanggup piggyback gf yang sakit kaki 🌚"
893815190583562240,2017-08-05 12:45:22,Duaa_e_aamir,Everyone should stay safe from #Golddiggers. And private affairs shouldnt be discussed on social media like #AmirFaryal dispute. Sad!
893800089830866944,2017-08-05 11:45:22,kickinglass55,Everyone should sue the stupid Democrat party for pushing this illegal obamacare TAX down our throats! https://t.co/JQ4ocTzgvX
893784991754182656,2017-08-05 10:45:22,MazinhoooX,Everyone should be trying to buy Dembele. I wish Liverpool were trying to buy Dembele. https://t.co/GCf45vkGFe
893769879710343169,2017-08-05 09:45:19,emmadee2k8,Everyone should watch the new @ROOM94 video when it comes out #ROOM94NewMusicVideo
893754794334081024,2017-08-05 08:45:22,123db_GEEK,Everyone should add @mikejulietbravo to their social media life! #FF https://t.co/HVnlpGp8Sq
893739680818110464,2017-08-05 07:45:19,tamaykiper,"Everyone should watch @aitruthfilm &amp; as a #susty professional, I get sweet deals. DM for free tickets! 🎟🎬 #climatechange #BeInconvenient"
893724591746465792,2017-08-05 06:45:21,proinstallav,"Everyone should feel safe in their homes. If you're concerned about intruders, our #SecuritySystem can keep them out https://t.co/mMj6GYeZz3 https://t.co/YCK8OmL1dE"
893709496039559169,2017-08-05 05:45:22,lunacastilho,everyone should believe in something. I believe I should go to the beach 😂🙌🏼🙏🏼☀️🌴💦 #Maldives 📸… https://t.co/rOvxIu1Dzf
893694394573791232,2017-08-05 04:45:22,CrixusFPS,Everyone should vote yes
893664198265151489,2017-08-05 02:45:23,GreyouTT,"Everyone should watch this beautiful creation.

https://t.co/Shwv8TTmD4"
893649083377766400,2017-08-05 01:45:19,crimsonclover98,everyone should have this on their playlist tonight just sayin' https://t.co/cXAsNa00Tu
893633986139795456,2017-08-05 00:45:19,chrisfrantz,"everyone should be following this vision @HTC_MalloryM !
#WeAreTexans
#TexansCheer https://t.co/rOdvvHdptm"
893603787734110208,2017-08-04 22:45:20,jtlevy,"Everyone should follow @DLind anyway, but in the meantime, Thread. https://t.co/EsMYdDHPcM"
893588699262337024,2017-08-04 21:45:22,__EMerica__,Everyone should go get a cat because I can't https://t.co/rr5E0Vq5fY
893573595657523200,2017-08-04 20:45:21,msnuk,Everyone should read this husband's love letter to his 'curvy' wife https://t.co/GOI050mwMV https://t.co/AKeDlJ2XbM
893558510893514752,2017-08-04 19:45:25,carlitosxguey,Everyone should get their ass beat at least once in their life
893543402209329152,2017-08-04 18:45:22,sweetraconteur,Everyone should read this by Luke Waltham https://t.co/SMvGlhELn9 https://t.co/0owruZ2rPO
893528299078467584,2017-08-04 17:45:22,Sophiaessig,Everyone should listen to the fleshtones this has been a PSA
893513201467269121,2017-08-04 16:45:22,FranziaFanon,Everyone should go see Columbus bc it's dope and a great debut from @kogonada https://t.co/CMYSAKaHP5
893498088018419713,2017-08-04 15:45:19,SausageFinks,"Everyone should take a couple minutes out of their day to read this, Mata is truly an inspiration https://t.co/RWNavkhoFW"
893482991619416064,2017-08-04 14:45:19,EyesOnLovato,EVERYONE SHOULD CHECK IT OUT!!! https://t.co/ng8EBDjh1U
893467901998518272,2017-08-04 13:45:22,jogle47,Everyone should listen to the son Rumors by Neffex like rn
893452802906705921,2017-08-04 12:45:22,lehsacmurd,Everyone should read this https://t.co/UPpLEOfx4i
893437704762830848,2017-08-04 11:45:22,CYSLOEY,Everyone should go stream #Kokobop in every sites so that we can get more wins and trophies ! Congratulations FAM we got our  #KOKOBOP7thwin
893422604991643648,2017-08-04 10:45:22,0xfce2,Everyone should be using this for everything all the time https://t.co/9T0cQ6Xz25
893407493967065088,2017-08-04 09:45:19,breakfreecrew,Everyone should check them out https://t.co/xkeOZBMJbS https://t.co/qOA9s0k9NZ
893392393038254080,2017-08-04 08:45:19,FPL_Lamb,Everyone should follow @FPLFamily . Great new account for #FPL
893377305933893634,2017-08-04 07:45:22,lizxord,everyone should read this https://t.co/faBXObX315
893362194154258432,2017-08-04 06:45:19,_lovestreams,everyone should listen to more Belle &amp; Sebastian
893331997602361345,2017-08-04 04:45:20,Bexlia,Everyone should celebrate their locs like this https://t.co/n6o8EWDWju
893316905494208513,2017-08-04 03:45:21,_Proto,Everyone should read this book. https://t.co/2OshO2WBbY
893301808189263872,2017-08-04 02:45:22,bradforte1,Everyone should consider this https://t.co/Op1FvoOV7M
893271606394363908,2017-08-04 00:45:21,XGladimusX,Everyone should take a moment to appreciate your funny vines. https://t.co/hmNea4rJ8B
