917642206906802177,2017-10-10 06:45:25,ArthurFooksake,"Everyone should be following @unionjackradio I love these guys and their brilliant station.
My new favourite."
917627103444590593,2017-10-10 05:45:24,BESSONDEBILITY,Everyone should consider to the boys of @whydontwemusic as the eighth wonder in the whole world.💛 https://t.co/u0nko2EHXF
917612007552987136,2017-10-10 04:45:25,HaleyArispe,"Everyone should watch:

2014 - Brave New Voices (Finals) - ""Somewhere in America"" by Los Angeles... https://t.co/OPTTwEwk7G via @YouTube"
917596882439856128,2017-10-10 03:45:19,laffytaffy0418,everyone should have a couple of friends that they can just sit&amp;have hour long conversations talking about Jesus together bc man it's great.
917581783645818880,2017-10-10 02:45:19,bazzweezy,Everyone should slick have one tho but I'm just saying https://t.co/nNihdI7ZFW
917551584610885632,2017-10-10 00:45:19,RainsStorm19,"EVERYONE should have the right to bare arms.

Seriously.

Sometimes it gets really hot, and sleeveless shirts are a must."
917536507585372160,2017-10-09 23:45:25,HillsftDolan,Everyone should know how much I love @allyhills 🖤
917521410783797249,2017-10-09 22:45:25,Claire_Crowley_,"Everyone should be watching #liar right now, such a well written, topical show"
917506307954896896,2017-10-09 21:45:24,mich_stephens,EVERYONE SHOULD BE FOLLOWING AMANDA https://t.co/YpkuNxnHWs
917491185807007744,2017-10-09 20:45:19,doraebinn,everyone should read this https://t.co/gDCGvDrvj5
917476105832955904,2017-10-09 19:45:24,MilkyLazarus,Everyone should watch bbc1
917460988596645888,2017-10-09 18:45:19,captainpolaroid,Everyone should play this https://t.co/rCyoxaHRWd
917445911906623491,2017-10-09 17:45:25,ashleyingordino,everyone should be praying at a time like this but instead everyone’s just pointing fingers.
917430788722851840,2017-10-09 16:45:19,LexBerndt,EVERYONE SHOULD WATCH THIS!!!!!! https://t.co/J4mrZQVQeR
917415711806447617,2017-10-09 15:45:25,derekmarks23,Everyone should take the time to read this. https://t.co/YrJTZL3mcb
917400589553721344,2017-10-09 14:45:19,ItsGentleshy,Everyone should become the opposite of what they are to become more than they are given with...
917385514856046592,2017-10-09 13:45:25,DPAssociation,Everyone should read this #diamond IG post. 👏👏👏 @Rapaport @reenaahluwalia #RealisRare https://t.co/fkfnQBwKkt
917370391697358848,2017-10-09 12:45:19,KitToTheKat,Everyone should post this on their walls!!  The reason we have this degenerate is that people like you and me... https://t.co/3mtzZnfGYL
917355313312841729,2017-10-09 11:45:24,LlewelynRuby,Everyone should be awake and aware because it’s spreading and this is dangerous !! Please keep yourselves updated &amp; keep in touch w/ friends
917340214141452288,2017-10-09 10:45:25,BracewellMr,EVERYONE should come to this!  I find his blogs invaluable. https://t.co/PRQNi1JrUE
917325093650313216,2017-10-09 09:45:20,DenisKitoo,Everyone should stick to their lane 😂😂😂 This is muuuurda. Caroline Mutoko Hapana https://t.co/zITRy7pcbp
917309992889335809,2017-10-09 08:45:19,mlanganwriter,"Everyone should read @DavidOlusoga's massively informative, important, beautifully written book on Black British history #BlackHistoryMonth https://t.co/NMK2f2ivPd"
917294893667463169,2017-10-09 07:45:19,lovinlany,Everyone should listen to this https://t.co/nPtlrVEBIV
917279795267768320,2017-10-09 06:45:20,strawberryshoe_,Everyone should jam out to this on da way to Miami https://t.co/U8VwBjLiXx
917264719274110978,2017-10-09 05:45:25,_morganfowler_,"Everyone should go subscribe to @RickyPDillon , his songs are always bops!🤘🏻 https://t.co/auP8mzWPCw"
917249595448557571,2017-10-09 04:45:19,ktgutz_,Everyone should go follow my pledge brother. He's pretty handsome and has some good tweets @LupinTheDawg 🐾
917234493559250944,2017-10-09 03:45:19,mikehess,Everyone should read this thread. Especially men https://t.co/eUfHDcKMf7
917219397533548550,2017-10-09 02:45:20,souljaes,Everyone should know this
917204295124115456,2017-10-09 01:45:19,pageymason,Everyone should see this faces and hear these names #GunControlnow https://t.co/7WTYK1iRkz
917189193939410944,2017-10-09 00:45:19,manicwaterfly,Everyone should have enough money to get plastic surgery. — Beverly Johnson
917174119459733504,2017-10-08 23:45:25,_MilkyMelanin_,Everyone should read this thread b/c wtf https://t.co/AB1xS9WHMO
917158998847008768,2017-10-08 22:45:19,outsidemagazine,Everyone should have a favorite henley. https://t.co/7OfOUa9nvl
917143896517308417,2017-10-08 21:45:19,solitary_gamer,"Everyone should be able to view the video on vidme, but if you can't watch it on vidme, the dailymotion link should work."
917128822465560577,2017-10-08 20:45:25,maddyyy03,everyone should go watch the movie unconditional you will ball your eyes out.. but it's so good.
917113697625030656,2017-10-08 19:45:19,Conruthhoward,Everyone should play the National Anthem on phones &amp; take a knee every time Pence is around. Especially when he approaches the White House. https://t.co/M7b2W97wN2
917098601024602112,2017-10-08 18:45:20,VijayGo85865290,"Everyone should understand that Left and Communist mentality is against DEMOCRACY

Crush them now

#BJPExposesKillerLeft https://t.co/nAnCgA0XWj"
917083498422312960,2017-10-08 17:45:19,IWSHTM,"Everyone should close their FB account. Shut it down. At this point it is just an arm of the Russian propaganda machine, as is twitter. https://t.co/JPy0Rw3K28"
917068423955283968,2017-10-08 16:45:25,dazzlingIester,everyone should go listen to #aFunSong by @RickyPDillon bc it's a FUN BOP!! https://t.co/B9wSh1Dctg
917023101526745088,2017-10-08 13:45:19,skmsw,Everyone should be aware of the latest effort to strip Obamacare.  Read these two dozen or so tweets and be ready to act. https://t.co/SgdM9LsFKk
917008004519575552,2017-10-08 12:45:20,BizarroFreedom,Everyone should read Finder by Carla Speed MacNeil... because it is one if the best comics ever. Here it is for free https://t.co/WtZzWQi5r4 https://t.co/L3IYuQ3H1U
916992901199962117,2017-10-08 11:45:19,hatsunebot_,Everyone should keep love on their mind!
916977805048426496,2017-10-08 10:45:20,deezel,Everyone should just do numerical scales.
916962727461031936,2017-10-08 09:45:25,tbsbi14,Everyone should watch this! https://t.co/YBCgIjQaRb
916947607284363264,2017-10-08 08:45:20,Foffy_the_Sheep,Everyone should give Yui a hug
916917430319853568,2017-10-08 06:45:25,GrimmxL,Everyone should love themselves
916902305269551104,2017-10-08 05:45:19,SkyyyySkyyyy,"everyone should be there for themselves, but it isn't enough. https://t.co/DVFXJA6Nks"
916887228630032384,2017-10-08 04:45:24,Moy05_,Everyone should be happy &amp; deserves to be happy
916872130289033216,2017-10-08 03:45:25,MorganStillYDGN,Everyone should watch Call the Midwife on Netflix. It's such a cute show. It's sooo good. Just letting y'all know
916857009558786049,2017-10-08 02:45:20,BobBombalicki,Everyone should watch Star Wars! 👾 https://t.co/Wm5F4qeZnT
916841908529332226,2017-10-08 01:45:19,JoeyLeafs34,Everyone should watch this https://t.co/9Zq6cDq1cf
916826806296002561,2017-10-08 00:45:19,TBone2024,Everyone should see This! https://t.co/TQ3QJUN86F
916811732219133952,2017-10-07 23:45:25,KarelMartellus,"Everyone should see the greatest story never told. Hitler was the greatest man in recent history.
https://t.co/5tqQwgijhw"
916796609656086529,2017-10-07 22:45:19,thesyddykid,"Everyone should study abroad, it's such a learning experience. Sooo new and exciting."
916781508026818560,2017-10-07 21:45:19,ecksmc1972,"EVERYONE should pay attention #BattleForTheNet

#NetNeutrality #twt https://t.co/TAIjBhqURV"
916766408473579520,2017-10-07 20:45:19,cara_leighann,Everyone should get a BFF that drags you across the south to see random concerts like @kelseeyyy_ann does to me. 😂
916751311172911104,2017-10-07 19:45:19,Ponfarr65,"Everyone should watch this Movie! Amazing &amp; powerful insight! Tools for all in real life, could change the world... https://t.co/hml2l480hA"
916736210583789568,2017-10-07 18:45:19,SumiSrkr,Everyone should answer this but everyone should answer this with yes https://t.co/5hBVX3xlWD
916721112322514944,2017-10-07 17:45:19,wdwjanielx,everyone should go follow @wdwbenubs 🤷‍♀️💜 https://t.co/rLRTug4fsJ
916706036119068672,2017-10-07 16:45:25,babe_yr,Everyone should have this kind of fun and vibe on Halloween instead of going around and hurting each other. https://t.co/RGWgu96BlG
916690914516467712,2017-10-07 15:45:19,elenArchivist,EVERYONE SHOULD PICK UP A COPY. AND ANOTHER TO GIVE TO A FRIEND! https://t.co/V50vD8UN4K
916675840573714433,2017-10-07 14:45:26,Funosh_sa,"Everyone should have a Hoe phase, It build character"
916660715594825728,2017-10-07 13:45:19,LCHNPUM,everyone should sleep if they are sleepy! please rest! o n o
916645612577112066,2017-10-07 12:45:19,Maggs_Horan,"Everyone should think like this 👏❤
https://t.co/MZhdTBuVom"
916630542136705026,2017-10-07 11:45:26,addictedtosmacc,"Everyone should get CEFTRIAXONE, METRONIDAZOLE and GENTAMICIN. Can never be too careful with #Sepsis
#altPHEM https://t.co/lTfSIOp2Kf"
916615414792073216,2017-10-07 10:45:19,LYNNception_,everyone should watch this drama okay https://t.co/hmREHqo7VH
916600341059092480,2017-10-07 09:45:25,ankita655,Everyone should immediately rush to the toy world. You can't miss this at all @toysrus_india #ToysRUsInIndia https://t.co/NDnoiakJrS
916585242265247744,2017-10-07 08:45:25,clrncshyn,EVERYONE SHOULD REALLY WATCH IT
916570148814807040,2017-10-07 07:45:27,_daddychrisss,everyone should watch big mouth
916555019939332096,2017-10-07 06:45:20,PhiaFiction,Everyone should listen to it 24/7 https://t.co/ILqbUm2GSH
916539916338601986,2017-10-07 05:45:19,samsabye,"Everyone should proud of themselves. You are here because of your effort, study and strength. Love yourself more than anyone else 👌🏽"
916524841322242048,2017-10-07 04:45:25,mayramalagon21,EVERYONE SHOULD GO WATCH ICARUS &amp; then listen to this podcast. Become aware. https://t.co/wlhhshfDbN
916494618274885632,2017-10-07 02:45:19,AndreaGirones,Everyone should get it right now https://t.co/KLoe8XiqRl
916479521636761601,2017-10-07 01:45:19,KroegerCarol,Everyone should read this thread and take it to heart. https://t.co/yiMa3nPeFo
916464440647630848,2017-10-07 00:45:24,GuyNSinCity,Everyone should know CPR and how to tie a tourniquet. 489 people survived their injuries because someone knew. #VegasStrong
916449321205108737,2017-10-06 23:45:19,99freemind,everyone should watch this. Lots of eye opening info regarding the Islamic colonization of the West in here. (subtitled) https://t.co/wTuKwQKNHu
916434223812063232,2017-10-06 22:45:20,PeskyRattigan,Everyone Should Hear #2781:Sexy Coffee Pot by Tony Alvon &amp; The Belairs
916419121624915968,2017-10-06 21:45:19,EMlLlA,everyone should endorse the luxury brand that is the targaryens
916404050739867648,2017-10-06 20:45:26,MGSchneiderArt,"Everyone should listen to this masterpiece // Todo el mundo debería escuchar esta obra maestra lpm
https://t.co/hIg7xToDTj"
916373847837831168,2017-10-06 18:45:25,gutbuck,Everyone should be apologising to laurel. #Emmerdale
916358727686529024,2017-10-06 17:45:20,VSEAILEE,EVERYONE SHOULD EXPERIENCE MARK’S DM AT LEAST ONCE
916328548507410437,2017-10-06 15:45:25,RoadsKingdoms,Everyone should go to Key West right now. Here's @thornburgh's insider guide: https://t.co/dy84LHHvGU
916313454859796480,2017-10-06 14:45:26,MDOmarF46360567,"Everyone should know ... - Because of the mistake, the secret organs are small!
https://t.co/eE97srTr77 https://t.co/Ug6WikhIx3"
916298347081637888,2017-10-06 13:45:24,LJCasavant,Everyone should have the pleasure of knowing and learning from Sara!!! #DisabilityAwarenessMonth #StudentsWhoBlog #SassySara #CottingSchool https://t.co/xpwApSGMae
916283224464154624,2017-10-06 12:45:19,kojikabu,Everyone should report this POS account. https://t.co/hSV1ovMfZu
916253049449996288,2017-10-06 10:45:24,tammi_jo74,"Everyone should At least check it out
https://t.co/xgKnGbfx7T"
916237952451207168,2017-10-06 09:45:25,MackidHolbrook,Everyone should have holidays off. https://t.co/SvoOQOloZU
916222826134118400,2017-10-06 08:45:19,4chirps4me,Everyone should read this. #CNN#newsone#npr https://t.co/yFLWSYTblm
916207759443451904,2017-10-06 07:45:26,khepu_snail,Everyone should smile. Life really isn’t that serious. We make it hard. The sun rises. The sun sets. We just tend to complicate the progress
916192630484041728,2017-10-06 06:45:19,orphanblxack,EVERYONE SHOULD LISTEN TO S.L.U.T BECAUSE THAT SONG IS AN ANTHEM
916177528271728640,2017-10-06 05:45:19,style_icon13,Everyone should appreciate this wonderful leader of Haryana     @bishnoikuldeep  #KBishnoiWishesBhajanlalHBD https://t.co/Picy4GZUFJ
916162432367603717,2017-10-06 04:45:20,scottsherman,Everyone should watch. It's coming true. https://t.co/6o9chfclhI
916147333535952896,2017-10-06 03:45:20,vishnuganti,"Everyone should take part in the design process. The rules aren't established in VR, so non designers and developers can help collaborate on ideas and the user experience with 3D prototyping tools. #UXVR @510home @cascadesf https://t.co/jrtEtkkDLT"
916132230996492288,2017-10-06 02:45:19,brittebaussus,everyone should have a person
916117134240919552,2017-10-06 01:45:20,gracieedeighton,Everyone should add Spencer Pratt on Snapchat 😂 highly entertaining
916102032791973888,2017-10-06 00:45:19,StubsAndShows,Everyone should try a meditation nap. It's the biggest life hack
916086959428141056,2017-10-05 23:45:25,vlsanford,Everyone should fuck off and die
916071858151161857,2017-10-05 22:45:25,hey_its_squid,"Everyone should own a gun, but the average citizen shouldn’t have access to any devices that modify those guns to resemble automatics"
916056759998877697,2017-10-05 21:45:25,LillzAthletics,Everyone should just roll Morleys with me when I'm next down..  10pm settings. Tracksuits only.
916041657258172418,2017-10-05 20:45:24,nikita1372,Everyone should watch this . Loved it . proud of u @deepikapadukone for creating awareness on mental health ❤️ https://t.co/fpj84trtgy
916026534976143361,2017-10-05 19:45:19,lynnlaaa,"Everyone should follow this feed right now. Like now, now. https://t.co/Rtjj52l0Mg"
916011454435692544,2017-10-05 18:45:24,AttThatRides,Everyone should be riding! https://t.co/ZtecKoXiXr
915996368790888448,2017-10-05 17:45:27,MartinRedmonddd,Everyone should use the Pussyhat pictures as much as possible. #WomensMarch #LasVegasShooting https://t.co/bMrYpnbCTu
915981263139246080,2017-10-05 16:45:25,AndySandford,Everyone should bomb trying comedy as a reminder that you don't know what the fuck yer talking about &amp; feigning confidence won't help.
915966138432942080,2017-10-05 15:45:19,Kk_Mm_Ss,Everyone should enforce keeping the earth nice and clean.
915951062787358721,2017-10-05 14:45:25,AmyWarr86867443,Everyone should check out https://t.co/oZKKZXV9Q5. It’s solid.
915935936483024897,2017-10-05 13:45:19,HandmadeLily,Everyone should see https://t.co/0OkxXrNuPu
915905741571088384,2017-10-05 11:45:20,naira_em,Everyone should have a choice in what should happen to them https://t.co/TXqtq23cUS
915890663920562177,2017-10-05 10:45:25,CMN_BBO,"Everyone should have the chance to succeed in life, develop skills and build a career. The #PositivePeople project can help #biglotteryesf"
915875539683962880,2017-10-05 09:45:19,RandomPig_,"Everyone should know, Depression is not a 'gawa-gawa' lang. AND IT SEES NO SOCIAL STATUS,AGE, AND GENDER"
915860442794176512,2017-10-05 08:45:20,raptureponies,Everyone should see and hear @nickcave in Paris. #paris #france #nickcave https://t.co/soLP4go1Bt https://t.co/lKrUOEiuYD
915845339214602241,2017-10-05 07:45:19,liraru,"Everyone should read this.
Not all that we saw at the media and the newspapers was true, and it generates hate.
https://t.co/LnLsltvjzh"
915815141408514049,2017-10-05 05:45:19,Delay_Designs,Everyone should go check this guy out he is a beast artist @ReoCragun
915800041888952320,2017-10-05 04:45:19,phx787,Everyone should strive to be like this mom from Aho Girl https://t.co/V1A6od2fZB
915784965509455872,2017-10-05 03:45:24,Ahwaziahwazi,Everyone should serve #Islam according to his/her abilities
915754745909800960,2017-10-05 01:45:19,Explorationproj,Everyone should go to a #masquerade ball at least once in their life. Amazing. https://t.co/SRIvmMV65D
915739648130826240,2017-10-05 00:45:20,ErinHolzhauerNL,Everyone should experience a National Honor Society Induction at NLHS! Wow... Loved the tradition. Congrats to all new members! 💙💛
915724543909543937,2017-10-04 23:45:19,f_gallardo123,Everyone should have the right to feel beautiful. #KnowYourRights
915709444897439744,2017-10-04 22:45:19,dadddykee,everyone should really watch 'the kalief browder story' on netflix. you honestly will not regret it!
915694346434838528,2017-10-04 21:45:19,IamThaJoneses,Everyone should have a #1 fan!
915679247112445952,2017-10-04 20:45:19,erinbednarik,everyone should play friendo because @bayleemccollum got me addicted
915664174293827585,2017-10-04 19:45:26,MarionGoodwill,Everyone should have the chance to succeed through the power of work. Celebrate #NDEAM #wkdev https://t.co/mAehWrOeXC https://t.co/8wSv39H8Yp
915649047557414912,2017-10-04 18:45:19,staegvma,everyone should appreciate hobi more just saying
915633969042939904,2017-10-04 17:45:24,njkizzy,Everyone should have Fridays as a remote work day (with exceptions of course) but it's 2017 it should be a thing.
915618874451664896,2017-10-04 16:45:25,taher_at,Everyone should serve #Islam according to his/her abilities
915588650808762368,2017-10-04 14:45:19,CassieOutler,"Everyone should wear deodorant everyday. No exceptions, no excuses"
915573571367211008,2017-10-04 13:45:24,ChrisDisaster,Everyone should watch the #Generator Usage / #Safety video at https://t.co/D6X5oKDAxt #UtilityOutage #GeneratorSafety #PowerOutage #JITDT https://t.co/GJXCSKxDzs
915558453418000389,2017-10-04 12:45:20,yurisupremacist,everyone should just accept joyri are superior in everything and hop on their train.
915543372739178499,2017-10-04 11:45:24,RunRogueRacers,Everyone should be using a foam roller for the benefits of deep tissue massage.  If you are… https://t.co/8gQSGWcsVs
915528280635092992,2017-10-04 10:45:26,WordlyConfusion,Everyone should happy to hear about the great initiative by @mastercardindia #MastercardAtSSC https://t.co/o9rq2IEafD
915513176287879168,2017-10-04 09:45:25,BruceAshford,"Everyone should be quick to listen, slow to speak, and slow to anger, for human anger does not accomplish God’s righteousness.~James 1:19-20"
915482976195985409,2017-10-04 07:45:25,infalanble,everyone should be named alan.
915467855080054784,2017-10-04 06:45:19,SkinnyFlackoo,Everyone should wanna feel good 🙏🏻‼️
915437655441104896,2017-10-04 04:45:19,Eazyon1,Everyone should just be more like Post Malone. Thats the world I want to live in
915422552746475520,2017-10-04 03:45:18,Pbsegreve,Everyone should listen to this song ❤️ https://t.co/IKOBTvSM11
915407455646912512,2017-10-04 02:45:19,PaulHJossey,Everyone should read #atlasshrugged all of a sudden what professors say become irrelevant https://t.co/imzz6USeD2
915392355972276224,2017-10-04 01:45:19,D_Bake11,Everyone should be more worried about the tragedy that happened and helping other people rather than what the man is labeled as. https://t.co/W4ZEjgiqpe
915377254871425024,2017-10-04 00:45:19,Sydney__Marie12,Everyone should have a Bernese best friend at least once in their lifetime 😭💗 miss my Gunner every day https://t.co/9cEQRJX5DS
915362179125190656,2017-10-03 23:45:24,Matt_Hickey8,Everyone should read this thread https://t.co/O1CAnsRVhj
915347057564516352,2017-10-03 22:45:19,hrt6017,Everyone should read. https://t.co/tnbLagJgdx
915331981914677248,2017-10-03 21:45:25,joshabarro,Everyone should read this story https://t.co/iPsrMD83bT
915316857237684224,2017-10-03 20:45:19,stellioe,Everyone should try therapy I love it
915301766584926209,2017-10-03 19:45:21,dasyy_duke,Everyone should study sociology. If we understood the society we lived in more throughly social problems could be properly addressed
915286659737853952,2017-10-03 18:45:19,_KingofNudes,Everyone should have a problem day
915271559475904512,2017-10-03 17:45:19,TrevorPeele,"Everyone should watch ""Dear White People."" Open your eyes!"
915256489727606784,2017-10-03 16:45:26,Hannah_Bearr,"everyone should just come together and learn to live in the moment now, everything is too fucked up"
915241359430189056,2017-10-03 15:45:19,WriterByrd,Everyone should have a BHAG! https://t.co/MbkHkUJLlP
915226263182118912,2017-10-03 14:45:19,emilialeyva_,everyone should always have their airdrop on
915211164224708610,2017-10-03 13:45:20,circleandflame,Everyone should be so lucky! I know that my wife and I have been chasing each other through numerous lifetimes! It’s meant to be!❤️ https://t.co/pvcWXcZufM
915196061261602816,2017-10-03 12:45:19,gunsxforxhands,everyone should follow @oIiviatbest because she has the best tweets and is adorable?? thank me later?????
915180964929691649,2017-10-03 11:45:19,Zondervan,"Everyone should be quick to listen, slow to speak and slow to become angry. - James 1:19 NIV
 #verseoftheday https://t.co/bLkXRzv7gs https://t.co/gqqclQgBR1"
915165887174295552,2017-10-03 10:45:25,DdaannHhaanniiu,"Everyone should save this and just post when needed...

https://t.co/mZ6BwVqbMB"
915135666538688512,2017-10-03 08:45:19,rav2999,"Everyone should read arseblog today  , amazing article! #AFC #arsenal @arseblog https://t.co/ttY3Gt60Jc"
915120591585239040,2017-10-03 07:45:25,roro96m,Everyone should serve #Islam according to his/her abilities
915105488202633217,2017-10-03 06:45:24,amitranabjp,"Everyone should know that Modi Government constructed 3,00,000 toilets in Himachal.
#Modi4Himachal"
915090390285352961,2017-10-03 05:45:25,marysegaines,everyone should know by now I only want one person in this world and will work hard to get them 🤷🏽‍♂️❤️🙏🏽
915075291474620418,2017-10-03 04:45:25,gnarly_yarali,"Everyone should check out my playlist on Spotify and follow it. Real good vibes !
 https://t.co/ianBX5KnHe"
915045070822240256,2017-10-03 02:45:20,straybobblog,Everyone should go to Africa one day https://t.co/ghaBTKsG8n #Africa #travelphotography #travelblog #Adventure #biketravel #cycling #travel https://t.co/79YXftpsKK
915029988360859648,2017-10-03 01:45:24,ambronnn,"everyone should stop texting me asking me who pregnant lol me hell .... seriously though, not your business. 🤗"
915014870793207808,2017-10-03 00:45:20,menaabdelnaser,everyone should understand thisssss! https://t.co/ggO8RjpGNF
914999798817726464,2017-10-02 23:45:26,ChrisDisaster,Everyone should view the #Fire Behavior in the #Wildland / Urban Interface video at https://t.co/IAEuJQt01T #Wildfire #ForestFire #JITDT https://t.co/PACUX6Z2qE
914924294366412800,2017-10-02 18:45:24,YungRasta_Mon,Everyone should have the right to bear arms
914909175053918209,2017-10-02 17:45:20,danielle13200,Everyone should #PrayForTheWorld right now instead of waiting for a tragic event to happen!!!! 🙏
914894098976215040,2017-10-02 16:45:25,rachel_pasch14,Everyone should come show their support. https://t.co/y7PW75iiyS
914878974748106753,2017-10-02 15:45:19,iamdonsword,Everyone should try going out for a walk. You'll be filled with joy.
914863897789599749,2017-10-02 14:45:25,Amber_Addison_,Everyone should stop to thank the first responders in Vegas. I can't imagine how much more brutal this would've been w/out their response.
914848775075540992,2017-10-02 13:45:19,katsworld500,Everyone should #TakeAKnee till the flag represents #America. #racialjustice #guncontrol #healthcare #FreeSpeech #immigrants #ImpeachTrump
914833695906791428,2017-10-02 12:45:24,ChrisLauManson,Everyone should read this. https://t.co/zmbuxgI0vF
914818575524753410,2017-10-02 11:45:19,DreamDreamies,Everyone should stan ladies code
914803475761864705,2017-10-02 10:45:19,sreenivasrkm,Everyone should support #Mere10Guz @SwachhIndia https://t.co/gJJxZcu9oR
914788403157262336,2017-10-02 09:45:25,YusufSiva,"Everyone should join the initiative  to ensure a Swachh India! #Mere10Guz
@swachhindia https://t.co/4Re53kfPc9"
914773277523898368,2017-10-02 08:45:19,appie_appz,Everyone should contribute towards making India  Swachh and Swasth with this #MyCleanIndia concept https://t.co/yb5PMEHjNY
914758177140260864,2017-10-02 07:45:19,Mshannahhhh,Everyone should stay home tomorrow and be with their families
914727978747039744,2017-10-02 05:45:19,Shubh__03,Everyone should be responsible for keeping the 10 Guz around themselves clean. @SwachhIndia #Mere10Guz  https://t.co/4AbWbd7Vtm ..
914712886563319813,2017-10-02 04:45:21,Free_Alberta,Everyone should. Except Albertans from whom he stole $27 billion a year and $190 billion over his career as PM. #CanadaSucksAlbertaDry https://t.co/vbFq4x16q1
914697778399371264,2017-10-02 03:45:19,OctiSenpai,"Everyone should check out and sub to Rx Gaming over on Youtube.

Go do it, m80's. :V"
914652502758326272,2017-10-02 00:45:24,UFPublicSafety,Everyone should be careful about what you post on social media or text..once its out there you can't take it back..https://t.co/NeiB33jof9 https://t.co/y0xPhQrwWb
914637409463132160,2017-10-01 23:45:26,AubreyAttitude,Everyone should watch @Atypical
914622283821465601,2017-10-01 22:45:19,CAGabriel116,Everyone should be forced to work in some shape or form of retail to understand why you should act like a complete gooch to a cashier.
